tcpdump: verbose output suppressed, use -v or -vv for full protocol decode
listening on eth0, link-type EN10MB (Ethernet), capture size 262144 bytes
14:45:15.509760 IP 44.128.0.3.41038 > 08f712f06a98.8081: Flags [S], seq 1805582972, win 64860, options [mss 1380,sackOK,TS val 1882497040 ecr 0,nop,wscale 7], length 0
E..<{.@.>...,...	....N..k..|.......\74.....d...
p4..........
14:45:15.509810 IP 08f712f06a98.8081 > 44.128.0.3.41038: Flags [S.], seq 1934019811, ack 1805582973, win 64296, options [mss 1380,sackOK,TS val 1637511353 ecr 1882497040,nop,wscale 7], length 0
E..<..@.@...	...,......NsF..k..}...(74.....d...
a.p.p4......
14:45:15.510046 IP 44.128.0.3.41038 > 08f712f06a98.8081: Flags [.], ack 1, win 507, options [nop,nop,TS val 1882497041 ecr 1637511353], length 0
E..4{.@.>...,...	....N..k..}sF......7,.....
p4..a.p.
14:45:15.510798 IP 44.128.0.3.41038 > 08f712f06a98.8081: Flags [P.], seq 1:225, ack 1, win 507, options [nop,nop,TS val 1882497042 ecr 1637511353], length 224
E...{.@.>..9,...	....N..k..}sF......8......
p4..a.p.GET /api/artists/search?artist=alt-J HTTP/1.1
Accept: */*
User-Agent: Restler for node.js
Host: searchservice.marathon.l4lb.thisdcos.directory:8081
Accept-Encoding: gzip, deflate
Content-Length: 0
Connection: close


14:45:15.510827 IP 08f712f06a98.8081 > 44.128.0.3.41038: Flags [.], ack 225, win 502, options [nop,nop,TS val 1637511354 ecr 1882497042], length 0
E..4.K@.@.ms	...,......NsF..k..]....7,.....
a.p.p4..
14:45:15.512016 IP 08f712f06a98.8081 > 44.128.0.3.41038: Flags [P.], seq 1:109, ack 225, win 502, options [nop,nop,TS val 1637511355 ecr 1882497042], length 108
E....L@.@.m.	...,......NsF..k..]....7......
a.p.p4..HTTP/1.1 200 OK
Date: Sat, 13 Nov 2021 14:45:15 GMT
Content-type: application/json
Content-length: 46


14:45:15.512211 IP 44.128.0.3.41038 > 08f712f06a98.8081: Flags [.], ack 109, win 507, options [nop,nop,TS val 1882497043 ecr 1637511355], length 0
E..4{.@.>...,...	....N..k..]sF.P....7,.....
p4..a.p.
14:45:15.512241 IP 08f712f06a98.8081 > 44.128.0.3.41038: Flags [P.], seq 109:155, ack 225, win 502, options [nop,nop,TS val 1637511355 ecr 1882497043], length 46
E..b.M@.@.mC	...,......NsF.Pk..]....7Z.....
a.p.p4..{"id":"3XHO7cRUPCLOr6jwp8vsx5","name":"alt-J"}
14:45:15.512346 IP 44.128.0.3.41038 > 08f712f06a98.8081: Flags [.], ack 155, win 507, options [nop,nop,TS val 1882497043 ecr 1637511355], length 0
E..4{.@.>...,...	....N..k..]sF.~....7,.....
p4..a.p.
14:45:15.512596 IP 08f712f06a98.8081 > 44.128.0.3.41038: Flags [F.], seq 155, ack 225, win 502, options [nop,nop,TS val 1637511355 ecr 1882497043], length 0
E..4.N@.@.mp	...,......NsF.~k..]....7,.....
a.p.p4..
14:45:15.512656 IP 44.128.0.3.41038 > 08f712f06a98.8081: Flags [F.], seq 225, ack 155, win 507, options [nop,nop,TS val 1882497043 ecr 1637511355], length 0
E..4{.@.>...,...	....N..k..]sF.~....7,.....
p4..a.p.
14:45:15.512744 IP 44.128.0.3.41038 > 08f712f06a98.8081: Flags [.], ack 156, win 507, options [nop,nop,TS val 1882497044 ecr 1637511355], length 0
E..4{.@.>...,...	....N..k..^sF......7,.....
p4..a.p.
14:45:15.512759 IP 08f712f06a98.8081 > 44.128.0.3.41038: Flags [.], ack 226, win 502, options [nop,nop,TS val 1637511356 ecr 1882497043], length 0
E..4.O@.@.mo	...,......NsF..k..^....7,.....
a.p.p4..
14:45:15.539063 IP 08f712f06a98.42061 > 198.51.100.1.53: 40905+ PTR? 3.0.128.44.in-addr.arpa. (41)
E..E-.@.@...	....3d..M.5.14..............3.0.128.44.in-addr.arpa.....
14:45:15.564370 IP 198.51.100.1.53 > 08f712f06a98.42061: 40905 NXDomain 0/1/0 (96)
E..|..@.@....3d.	....5.M.h51.............3.0.128.44.in-addr.arpa................+.ampr.org.
hostmaster.5}.Nm..........u.....
14:45:15.566229 IP 08f712f06a98.45162 > 198.51.100.1.53: 58209+ PTR? 1.100.51.198.in-addr.arpa. (43)
E..G-"@.@...	....3d..j.5.34..a...........1.100.51.198.in-addr.arpa.....
14:45:15.578230 IP 198.51.100.1.53 > 08f712f06a98.45162: 58209 NXDomain 0/1/0 (97)
E..}..@.@....3d.	....5.j.i52.a...........1.100.51.198.in-addr.arpa................*.z.arin.net..dns-ops.9x9y..........
....*0
14:45:43.913268 IP 44.128.0.3.52428 > 08f712f06a98.8081: Flags [S], seq 2412840035, win 64860, options [mss 1380,sackOK,TS val 3144411240 ecr 0,nop,wscale 7], length 0
E..<..@.>.6.,...	..........c.......\74.....d...
.k.h........
14:45:43.913311 IP 08f712f06a98.8081 > 44.128.0.3.52428: Flags [S.], seq 2923696128, ack 2412840036, win 64296, options [mss 1380,sackOK,TS val 1637539756 ecr 3144411240,nop,wscale 7], length 0
E..<..@.@...	...,........D.....d...(74.....d...
a....k.h....
14:45:43.913498 IP 44.128.0.3.52428 > 08f712f06a98.8081: Flags [.], ack 1, win 507, options [nop,nop,TS val 3144411240 ecr 1637539756], length 0
E..4..@.>.6",...	..........d.D......7,.....
.k.ha...
14:45:43.913734 IP 44.128.0.3.52428 > 08f712f06a98.8081: Flags [P.], seq 1:225, ack 1, win 507, options [nop,nop,TS val 3144411240 ecr 1637539756], length 224
E.....@.>.5A,...	..........d.D......8......
.k.ha...GET /api/artists/search?artist=alt-J HTTP/1.1
Accept: */*
User-Agent: Restler for node.js
Host: searchservice.marathon.l4lb.thisdcos.directory:8081
Accept-Encoding: gzip, deflate
Content-Length: 0
Connection: close


14:45:43.913773 IP 08f712f06a98.8081 > 44.128.0.3.52428: Flags [.], ack 225, win 502, options [nop,nop,TS val 1637539757 ecr 3144411240], length 0
E..4..@.@.,.	...,........D.....D....7,.....
a....k.h
14:45:43.914417 IP 08f712f06a98.8081 > 44.128.0.3.52428: Flags [P.], seq 1:109, ack 225, win 502, options [nop,nop,TS val 1637539757 ecr 3144411240], length 108
E.....@.@.,Q	...,........D.....D....7......
a....k.hHTTP/1.1 200 OK
Date: Sat, 13 Nov 2021 14:45:43 GMT
Content-type: application/json
Content-length: 46


14:45:43.914515 IP 44.128.0.3.52428 > 08f712f06a98.8081: Flags [.], ack 109, win 507, options [nop,nop,TS val 3144411241 ecr 1637539757], length 0
E..4..@.>.6 ,...	..........D.D.m....7,.....
.k.ia...
14:45:43.914533 IP 08f712f06a98.8081 > 44.128.0.3.52428: Flags [P.], seq 109:155, ack 225, win 502, options [nop,nop,TS val 1637539757 ecr 3144411241], length 46
E..b..@.@.,.	...,........D.m...D....7Z.....
a....k.i{"id":"3XHO7cRUPCLOr6jwp8vsx5","name":"alt-J"}
14:45:43.914620 IP 44.128.0.3.52428 > 08f712f06a98.8081: Flags [.], ack 155, win 507, options [nop,nop,TS val 3144411241 ecr 1637539757], length 0
E..4..@.>.6.,...	..........D.D......7,.....
.k.ia...
14:45:43.915864 IP 44.128.0.3.52428 > 08f712f06a98.8081: Flags [F.], seq 225, ack 155, win 507, options [nop,nop,TS val 3144411243 ecr 1637539757], length 0
E..4..@.>.6.,...	..........D.D......7,.....
.k.ka...
14:45:43.963688 IP 08f712f06a98.8081 > 44.128.0.3.52428: Flags [.], ack 226, win 502, options [nop,nop,TS val 1637539807 ecr 3144411243], length 0
E..4..@.@.,.	...,........D.....E....7,.....
a....k.k
14:45:44.316064 IP 08f712f06a98.8081 > 44.128.0.3.52428: Flags [F.], seq 155, ack 226, win 502, options [nop,nop,TS val 1637540159 ecr 3144411243], length 0
E..4..@.@.,.	...,........D.....E....7,.....
a..?.k.k
14:45:44.316347 IP 44.128.0.3.52428 > 08f712f06a98.8081: Flags [.], ack 156, win 507, options [nop,nop,TS val 3144411643 ecr 1637540159], length 0
E..4..@.>...,...	..........E.D.......&.....
.k..a..?
14:45:54.922285 IP 44.128.0.3.41252 > 08f712f06a98.8081: Flags [S], seq 2775920677, win 64860, options [mss 1380,sackOK,TS val 1882536453 ecr 0,nop,wscale 7], length 0
E..<.Z@.>.%\,...	....$...u0%.......\74.....d...
p5:.........
14:45:54.922313 IP 08f712f06a98.8081 > 44.128.0.3.41252: Flags [S.], seq 930486943, ack 2775920678, win 64296, options [mss 1380,sackOK,TS val 1637550765 ecr 1882536453,nop,wscale 7], length 0
E..<..@.@...	...,......$7v...u0&...(74.....d...
a.
.p5:.....
14:45:54.922452 IP 44.128.0.3.41252 > 08f712f06a98.8081: Flags [.], ack 1, win 507, options [nop,nop,TS val 1882536453 ecr 1637550765], length 0
E..4.[@.>.%c,...	....$...u0&7v......7,.....
p5:.a.
.
14:45:54.922836 IP 44.128.0.3.41252 > 08f712f06a98.8081: Flags [P.], seq 1:225, ack 1, win 507, options [nop,nop,TS val 1882536454 ecr 1637550765], length 224
E....\@.>.$.,...	....$...u0&7v......8......
p5:.a.
.GET /api/artists/search?artist=alt-J HTTP/1.1
Accept: */*
User-Agent: Restler for node.js
Host: searchservice.marathon.l4lb.thisdcos.directory:8081
Accept-Encoding: gzip, deflate
Content-Length: 0
Connection: close


14:45:54.922855 IP 08f712f06a98.8081 > 44.128.0.3.41252: Flags [.], ack 225, win 502, options [nop,nop,TS val 1637550766 ecr 1882536454], length 0
E..4v.@.@...	...,......$7v...u1.....7,.....
a.
.p5:.
14:45:54.923565 IP 08f712f06a98.8081 > 44.128.0.3.41252: Flags [P.], seq 1:109, ack 225, win 502, options [nop,nop,TS val 1637550766 ecr 1882536454], length 108
E...v.@.@..f	...,......$7v...u1.....7......
a.
.p5:.HTTP/1.1 200 OK
Date: Sat, 13 Nov 2021 14:45:54 GMT
Content-type: application/json
Content-length: 46


14:45:54.923655 IP 44.128.0.3.41252 > 08f712f06a98.8081: Flags [.], ack 109, win 507, options [nop,nop,TS val 1882536454 ecr 1637550766], length 0
E..4.]@.>.%a,...	....$...u1.7v......7,.....
p5:.a.
.
14:45:54.923700 IP 08f712f06a98.8081 > 44.128.0.3.41252: Flags [P.], seq 109:155, ack 225, win 502, options [nop,nop,TS val 1637550767 ecr 1882536454], length 46
E..bv.@.@...	...,......$7v...u1.....7Z.....
a.
.p5:.{"id":"3XHO7cRUPCLOr6jwp8vsx5","name":"alt-J"}
14:45:54.923770 IP 44.128.0.3.41252 > 08f712f06a98.8081: Flags [.], ack 155, win 507, options [nop,nop,TS val 1882536455 ecr 1637550767], length 0
E..4.^@.>.%`,...	....$...u1.7v.:....7,.....
p5:.a.
.
14:45:54.923974 IP 08f712f06a98.8081 > 44.128.0.3.41252: Flags [F.], seq 155, ack 225, win 502, options [nop,nop,TS val 1637550767 ecr 1882536455], length 0
E..4v.@.@...	...,......$7v.:.u1.....7,.....
a.
.p5:.
14:45:54.924279 IP 44.128.0.3.41252 > 08f712f06a98.8081: Flags [F.], seq 225, ack 156, win 507, options [nop,nop,TS val 1882536455 ecr 1637550767], length 0
E..4._@.>.%_,...	....$...u1.7v.;....7,.....
p5:.a.
.
14:45:54.924290 IP 08f712f06a98.8081 > 44.128.0.3.41252: Flags [.], ack 226, win 502, options [nop,nop,TS val 1637550767 ecr 1882536455], length 0
E..4v.@.@...	...,......$7v.;.u1.....7,.....
a.
.p5:.
14:46:07.161140 IP 44.128.0.3.52574 > 08f712f06a98.8081: Flags [S], seq 4179726021, win 64860, options [mss 1380,sackOK,TS val 3144434488 ecr 0,nop,wscale 7], length 0
E..<..@.>.`.,...	....^...!.........\74.....d...
.lC8........
14:46:07.161177 IP 08f712f06a98.8081 > 44.128.0.3.52574: Flags [S.], seq 4232314612, ack 4179726022, win 64296, options [mss 1380,sackOK,TS val 1637563004 ecr 3144434488,nop,wscale 7], length 0
E..<..@.@...	...,......^.C...!.....(74.....d...
a.:|.lC8....
14:46:07.161331 IP 44.128.0.3.52574 > 08f712f06a98.8081: Flags [.], ack 1, win 507, options [nop,nop,TS val 3144434488 ecr 1637563004], length 0
E..4..@.>.`.,...	....^...!...C......7,.....
.lC8a.:|
14:46:07.161570 IP 44.128.0.3.52574 > 08f712f06a98.8081: Flags [P.], seq 1:225, ack 1, win 507, options [nop,nop,TS val 3144434488 ecr 1637563004], length 224
E.....@.>._.,...	....^...!...C......8......
.lC8a.:|GET /api/artists/search?artist=alt-J HTTP/1.1
Accept: */*
User-Agent: Restler for node.js
Host: searchservice.marathon.l4lb.thisdcos.directory:8081
Accept-Encoding: gzip, deflate
Content-Length: 0
Connection: close


14:46:07.161608 IP 08f712f06a98.8081 > 44.128.0.3.52574: Flags [.], ack 225, win 502, options [nop,nop,TS val 1637563004 ecr 3144434488], length 0
E..4..@.@.."	...,......^.C...!......7,.....
a.:|.lC8
14:46:07.162970 IP 08f712f06a98.8081 > 44.128.0.3.52574: Flags [P.], seq 1:109, ack 225, win 502, options [nop,nop,TS val 1637563006 ecr 3144434488], length 108
E.....@.@...	...,......^.C...!......7......
a.:~.lC8HTTP/1.1 200 OK
Date: Sat, 13 Nov 2021 14:46:07 GMT
Content-type: application/json
Content-length: 46


14:46:07.163203 IP 44.128.0.3.52574 > 08f712f06a98.8081: Flags [.], ack 109, win 507, options [nop,nop,TS val 3144434490 ecr 1637563006], length 0
E..4..@.>.`.,...	....^...!...C.a....7,.....
.lC:a.:~
14:46:07.163236 IP 08f712f06a98.8081 > 44.128.0.3.52574: Flags [P.], seq 109:155, ack 225, win 502, options [nop,nop,TS val 1637563006 ecr 3144434490], length 46
E..b..@.@...	...,......^.C.a.!......7Z.....
a.:~.lC:{"id":"3XHO7cRUPCLOr6jwp8vsx5","name":"alt-J"}
14:46:07.163370 IP 44.128.0.3.52574 > 08f712f06a98.8081: Flags [.], ack 155, win 507, options [nop,nop,TS val 3144434490 ecr 1637563006], length 0
E..4..@.>.`.,...	....^...!...C......7,.....
.lC:a.:~
14:46:07.163621 IP 44.128.0.3.52574 > 08f712f06a98.8081: Flags [F.], seq 225, ack 155, win 507, options [nop,nop,TS val 3144434490 ecr 1637563006], length 0
E..4..@.>.`.,...	....^...!...C......7,.....
.lC:a.:~
14:46:07.163632 IP 08f712f06a98.8081 > 44.128.0.3.52574: Flags [F.], seq 155, ack 225, win 502, options [nop,nop,TS val 1637563006 ecr 3144434490], length 0
E..4..@.@...	...,......^.C...!......7,.....
a.:~.lC:
14:46:07.163709 IP 08f712f06a98.8081 > 44.128.0.3.52574: Flags [.], ack 226, win 502, options [nop,nop,TS val 1637563007 ecr 3144434490], length 0
E..4..@.@...	...,......^.C...!......7,.....
a.:..lC:
14:46:07.163868 IP 44.128.0.3.52574 > 08f712f06a98.8081: Flags [.], ack 156, win 507, options [nop,nop,TS val 3144434491 ecr 1637563006], length 0
E..4..@.>.`.,...	....^...!...C......7,.....
.lC;a.:~
14:46:16.236952 IP 44.128.0.3.41394 > 08f712f06a98.8081: Flags [S], seq 3871937143, win 64860, options [mss 1380,sackOK,TS val 1882557768 ecr 0,nop,wscale 7], length 0
E..<H.@.>...,...	..........w.......\74.....d...
p5.H........
14:46:16.236992 IP 08f712f06a98.8081 > 44.128.0.3.41394: Flags [S.], seq 3061671792, ack 3871937144, win 64296, options [mss 1380,sackOK,TS val 1637572080 ecr 1882557768,nop,wscale 7], length 0
E..<..@.@...	...,........}gp...x...(74.....d...
a.].p5.H....
14:46:16.237178 IP 44.128.0.3.41394 > 08f712f06a98.8081: Flags [.], ack 1, win 507, options [nop,nop,TS val 1882557768 ecr 1637572080], length 0
E..4H.@.>...,...	..........x.}gq....7,.....
p5.Ha.].
14:46:16.237397 IP 44.128.0.3.41394 > 08f712f06a98.8081: Flags [P.], seq 1:225, ack 1, win 507, options [nop,nop,TS val 1882557768 ecr 1637572080], length 224
E...H.@.>..9,...	..........x.}gq....8......
p5.Ha.].GET /api/artists/search?artist=alt-J HTTP/1.1
Accept: */*
User-Agent: Restler for node.js
Host: searchservice.marathon.l4lb.thisdcos.directory:8081
Accept-Encoding: gzip, deflate
Content-Length: 0
Connection: close


14:46:16.237437 IP 08f712f06a98.8081 > 44.128.0.3.41394: Flags [.], ack 225, win 502, options [nop,nop,TS val 1637572080 ecr 1882557768], length 0
E..4;.@.@..;	...,........}gq...X....7,.....
a.].p5.H
14:46:16.238548 IP 08f712f06a98.8081 > 44.128.0.3.41394: Flags [P.], seq 1:109, ack 225, win 502, options [nop,nop,TS val 1637572081 ecr 1882557768], length 108
E...;.@.@...	...,........}gq...X....7......
a.].p5.HHTTP/1.1 200 OK
Date: Sat, 13 Nov 2021 14:46:16 GMT
Content-type: application/json
Content-length: 46


14:46:16.238771 IP 44.128.0.3.41394 > 08f712f06a98.8081: Flags [.], ack 109, win 507, options [nop,nop,TS val 1882557770 ecr 1637572081], length 0
E..4H.@.>...,...	..........X.}g.....7,.....
p5.Ja.].
14:46:16.238822 IP 08f712f06a98.8081 > 44.128.0.3.41394: Flags [P.], seq 109:155, ack 225, win 502, options [nop,nop,TS val 1637572082 ecr 1882557770], length 46
E..b;.@.@...	...,........}g....X....7Z.....
a.].p5.J{"id":"3XHO7cRUPCLOr6jwp8vsx5","name":"alt-J"}
14:46:16.238992 IP 44.128.0.3.41394 > 08f712f06a98.8081: Flags [.], ack 155, win 507, options [nop,nop,TS val 1882557770 ecr 1637572082], length 0
E..4H.@.>...,...	..........X.}h.....7,.....
p5.Ja.].
14:46:16.239400 IP 08f712f06a98.8081 > 44.128.0.3.41394: Flags [F.], seq 155, ack 225, win 502, options [nop,nop,TS val 1637572082 ecr 1882557770], length 0
E..4;.@.@..8	...,........}h....X....7,.....
a.].p5.J
14:46:16.239915 IP 44.128.0.3.41394 > 08f712f06a98.8081: Flags [F.], seq 225, ack 156, win 507, options [nop,nop,TS val 1882557771 ecr 1637572082], length 0
E..4H.@.>...,...	..........X.}h.....7,.....
p5.Ka.].
14:46:16.239949 IP 08f712f06a98.8081 > 44.128.0.3.41394: Flags [.], ack 226, win 502, options [nop,nop,TS val 1637572083 ecr 1882557771], length 0
E..4;.@.@..7	...,........}h....Y....7,.....
a.].p5.K
14:46:44.276370 IP 44.128.0.3.52804 > 08f712f06a98.8081: Flags [S], seq 3833273902, win 64860, options [mss 1380,sackOK,TS val 3144471603 ecr 0,nop,wscale 7], length 0
E..<..@.>.J.,...	....D...{.........\74.....d...
.l.3........
14:46:44.276412 IP 08f712f06a98.8081 > 44.128.0.3.52804: Flags [S.], seq 3417512012, ack 3833273903, win 64296, options [mss 1380,sackOK,TS val 1637600119 ecr 3144471603,nop,wscale 7], length 0
E..<..@.@...	...,......D...L.{./...(74.....d...
a..w.l.3....
14:46:44.276609 IP 44.128.0.3.52804 > 08f712f06a98.8081: Flags [.], ack 1, win 507, options [nop,nop,TS val 3144471603 ecr 1637600119], length 0
E..4..@.>.J.,...	....D...{./...M....7,.....
.l.3a..w
14:46:44.276977 IP 44.128.0.3.52804 > 08f712f06a98.8081: Flags [P.], seq 1:225, ack 1, win 507, options [nop,nop,TS val 3144471604 ecr 1637600119], length 224
E.....@.>.J.,...	....D...{./...M....8......
.l.4a..wGET /api/artists/search?artist=alt-J HTTP/1.1
Accept: */*
User-Agent: Restler for node.js
Host: searchservice.marathon.l4lb.thisdcos.directory:8081
Accept-Encoding: gzip, deflate
Content-Length: 0
Connection: close


14:46:44.277021 IP 08f712f06a98.8081 > 44.128.0.3.52804: Flags [.], ack 225, win 502, options [nop,nop,TS val 1637600120 ecr 3144471604], length 0
E..4).@.@..		...,......D...M.{......7,.....
a..x.l.4
14:46:44.279883 IP 08f712f06a98.8081 > 44.128.0.3.52804: Flags [P.], seq 1:109, ack 225, win 502, options [nop,nop,TS val 1637600123 ecr 3144471604], length 108
E...).@.@...	...,......D...M.{......7......
a..{.l.4HTTP/1.1 200 OK
Date: Sat, 13 Nov 2021 14:46:44 GMT
Content-type: application/json
Content-length: 46


14:46:44.280010 IP 44.128.0.3.52804 > 08f712f06a98.8081: Flags [.], ack 109, win 507, options [nop,nop,TS val 3144471607 ecr 1637600123], length 0
E..4..@.>.J.,...	....D...{..........7,.....
.l.7a..{
14:46:44.280046 IP 08f712f06a98.8081 > 44.128.0.3.52804: Flags [P.], seq 109:155, ack 225, win 502, options [nop,nop,TS val 1637600123 ecr 3144471607], length 46
E..b).@.@...	...,......D.....{......7Z.....
a..{.l.7{"id":"3XHO7cRUPCLOr6jwp8vsx5","name":"alt-J"}
14:46:44.280118 IP 44.128.0.3.52804 > 08f712f06a98.8081: Flags [.], ack 155, win 507, options [nop,nop,TS val 3144471607 ecr 1637600123], length 0
E..4..@.>.J.,...	....D...{..........7,.....
.l.7a..{
14:46:44.280300 IP 44.128.0.3.52804 > 08f712f06a98.8081: Flags [F.], seq 225, ack 155, win 507, options [nop,nop,TS val 3144471607 ecr 1637600123], length 0
E..4..@.>.J.,...	....D...{..........7,.....
.l.7a..{
14:46:44.280382 IP 08f712f06a98.8081 > 44.128.0.3.52804: Flags [F.], seq 155, ack 226, win 502, options [nop,nop,TS val 1637600123 ecr 3144471607], length 0
E..4).@.@...	...,......D.....{......7,.....
a..{.l.7
14:46:44.280497 IP 44.128.0.3.52804 > 08f712f06a98.8081: Flags [.], ack 156, win 507, options [nop,nop,TS val 3144471607 ecr 1637600123], length 0
E..4..@.>.J.,...	....D...{..........7,.....
.l.7a..{
14:46:55.291467 IP 44.128.0.3.41638 > 08f712f06a98.8081: Flags [S], seq 269330538, win 64860, options [mss 1380,sackOK,TS val 1882596822 ecr 0,nop,wscale 7], length 0
E..<..@.>...,...	..........j.......\74.....d...
p6%.........
14:46:55.291496 IP 08f712f06a98.8081 > 44.128.0.3.41638: Flags [S.], seq 991798745, ack 269330539, win 64296, options [mss 1380,sackOK,TS val 1637611134 ecr 1882596822,nop,wscale 7], length 0
E..<..@.@...	...,.......;......k...(74.....d...
a..~p6%.....
14:46:55.291621 IP 44.128.0.3.41638 > 08f712f06a98.8081: Flags [.], ack 1, win 507, options [nop,nop,TS val 1882596822 ecr 1637611134], length 0
E..4..@.>...,...	..........k;.......7,.....
p6%.a..~
14:46:55.291798 IP 44.128.0.3.41638 > 08f712f06a98.8081: Flags [P.], seq 1:225, ack 1, win 507, options [nop,nop,TS val 1882596823 ecr 1637611134], length 224
E.....@.>..	,...	..........k;.......8......
p6%.a..~GET /api/artists/search?artist=alt-J HTTP/1.1
Accept: */*
User-Agent: Restler for node.js
Host: searchservice.marathon.l4lb.thisdcos.directory:8081
Accept-Encoding: gzip, deflate
Content-Length: 0
Connection: close


14:46:55.291807 IP 08f712f06a98.8081 > 44.128.0.3.41638: Flags [.], ack 225, win 502, options [nop,nop,TS val 1637611135 ecr 1882596823], length 0
E..4.h@.@..V	...,.......;......K....7,.....
a...p6%.
14:46:55.292650 IP 08f712f06a98.8081 > 44.128.0.3.41638: Flags [P.], seq 1:109, ack 225, win 502, options [nop,nop,TS val 1637611135 ecr 1882596823], length 108
E....i@.@...	...,.......;......K....7......
a...p6%.HTTP/1.1 200 OK
Date: Sat, 13 Nov 2021 14:46:55 GMT
Content-type: application/json
Content-length: 46


14:46:55.292767 IP 44.128.0.3.41638 > 08f712f06a98.8081: Flags [.], ack 109, win 507, options [nop,nop,TS val 1882596824 ecr 1637611135], length 0
E..4..@.>...,...	..........K;..F....7,.....
p6%.a...
14:46:55.292784 IP 08f712f06a98.8081 > 44.128.0.3.41638: Flags [P.], seq 109:155, ack 225, win 502, options [nop,nop,TS val 1637611136 ecr 1882596824], length 46
E..b.j@.@..&	...,.......;..F...K....7Z.....
a...p6%.{"id":"3XHO7cRUPCLOr6jwp8vsx5","name":"alt-J"}
14:46:55.292883 IP 44.128.0.3.41638 > 08f712f06a98.8081: Flags [.], ack 155, win 507, options [nop,nop,TS val 1882596824 ecr 1637611136], length 0
E..4..@.>...,...	..........K;..t....7,.....
p6%.a...
14:46:55.293197 IP 44.128.0.3.41638 > 08f712f06a98.8081: Flags [F.], seq 225, ack 155, win 507, options [nop,nop,TS val 1882596824 ecr 1637611136], length 0
E..4..@.>...,...	..........K;..t....7,.....
p6%.a...
14:46:55.293891 IP 08f712f06a98.8081 > 44.128.0.3.41638: Flags [F.], seq 155, ack 226, win 502, options [nop,nop,TS val 1637611137 ecr 1882596824], length 0
E..4.k@.@..S	...,.......;..t...L....7,.....
a...p6%.
14:46:55.294020 IP 44.128.0.3.41638 > 08f712f06a98.8081: Flags [.], ack 156, win 507, options [nop,nop,TS val 1882596825 ecr 1637611137], length 0
E..4..@.>...,...	..........L;..u....7,.....
p6%.a...
14:47:10.699264 IP 44.128.0.3.52984 > 08f712f06a98.8081: Flags [S], seq 1411165441, win 64860, options [mss 1380,sackOK,TS val 3144498026 ecr 0,nop,wscale 7], length 0
E..<.l@.>.&J,...	.......T..........\74.....d...
.m;j........
14:47:10.699310 IP 08f712f06a98.8081 > 44.128.0.3.52984: Flags [S.], seq 2853114614, ack 1411165442, win 64296, options [mss 1380,sackOK,TS val 1637626542 ecr 3144498026,nop,wscale 7], length 0
E..<..@.@...	...,...........T......(74.....d...
a.2..m;j....
14:47:10.699484 IP 44.128.0.3.52984 > 08f712f06a98.8081: Flags [.], ack 1, win 507, options [nop,nop,TS val 3144498026 ecr 1637626542], length 0
E..4.m@.>.&Q,...	.......T...........7,.....
.m;ja.2.
14:47:10.699733 IP 44.128.0.3.52984 > 08f712f06a98.8081: Flags [P.], seq 1:225, ack 1, win 507, options [nop,nop,TS val 3144498026 ecr 1637626542], length 224
E....n@.>.%p,...	.......T...........8......
.m;ja.2.GET /api/artists/search?artist=alt-J HTTP/1.1
Accept: */*
User-Agent: Restler for node.js
Host: searchservice.marathon.l4lb.thisdcos.directory:8081
Accept-Encoding: gzip, deflate
Content-Length: 0
Connection: close


14:47:10.699790 IP 08f712f06a98.8081 > 44.128.0.3.52984: Flags [.], ack 225, win 502, options [nop,nop,TS val 1637626543 ecr 3144498026], length 0
E..40n@.@..P	...,...........T.......7,.....
a.2..m;j
14:47:10.700926 IP 08f712f06a98.8081 > 44.128.0.3.52984: Flags [P.], seq 1:109, ack 225, win 502, options [nop,nop,TS val 1637626544 ecr 3144498026], length 108
E...0o@.@...	...,...........T.......7......
a.2..m;jHTTP/1.1 200 OK
Date: Sat, 13 Nov 2021 14:47:10 GMT
Content-type: application/json
Content-length: 46


14:47:10.701156 IP 44.128.0.3.52984 > 08f712f06a98.8081: Flags [.], ack 109, win 507, options [nop,nop,TS val 3144498028 ecr 1637626544], length 0
E..4.o@.>.&O,...	.......T......c....7,.....
.m;la.2.
14:47:10.701195 IP 08f712f06a98.8081 > 44.128.0.3.52984: Flags [P.], seq 109:155, ack 225, win 502, options [nop,nop,TS val 1637626544 ecr 3144498028], length 46
E..b0p@.@.. 	...,..........cT.......7Z.....
a.2..m;l{"id":"3XHO7cRUPCLOr6jwp8vsx5","name":"alt-J"}
14:47:10.701333 IP 44.128.0.3.52984 > 08f712f06a98.8081: Flags [.], ack 155, win 507, options [nop,nop,TS val 3144498028 ecr 1637626544], length 0
E..4.p@.>.&N,...	.......T...........7,.....
.m;la.2.
14:47:10.701743 IP 08f712f06a98.8081 > 44.128.0.3.52984: Flags [F.], seq 155, ack 225, win 502, options [nop,nop,TS val 1637626545 ecr 3144498028], length 0
E..40q@.@..M	...,...........T.......7,.....
a.2..m;l
14:47:10.701781 IP 44.128.0.3.52984 > 08f712f06a98.8081: Flags [F.], seq 225, ack 155, win 507, options [nop,nop,TS val 3144498028 ecr 1637626544], length 0
E..4.q@.>.&M,...	.......T...........7,.....
.m;la.2.
14:47:10.701917 IP 44.128.0.3.52984 > 08f712f06a98.8081: Flags [.], ack 156, win 507, options [nop,nop,TS val 3144498029 ecr 1637626545], length 0
E..4.r@.>.&L,...	.......T...........7,.....
.m;ma.2.
14:47:10.701936 IP 08f712f06a98.8081 > 44.128.0.3.52984: Flags [.], ack 226, win 502, options [nop,nop,TS val 1637626545 ecr 3144498028], length 0
E..40r@.@..L	...,...........T.......7,.....
a.2..m;l
14:47:18.388516 IP 44.128.0.3.41792 > 08f712f06a98.8081: Flags [S], seq 3551125233, win 64860, options [mss 1380,sackOK,TS val 1882619919 ecr 0,nop,wscale 7], length 0
E..<..@.>.c.,...	....@.............\74.....d...
p6..........
14:47:18.388558 IP 08f712f06a98.8081 > 44.128.0.3.41792: Flags [S.], seq 3010553595, ack 3551125234, win 64296, options [mss 1380,sackOK,TS val 1637634231 ecr 1882619919,nop,wscale 7], length 0
E..<..@.@...	...,......@.qf........(74.....d...
a.P.p6......
14:47:18.388748 IP 44.128.0.3.41792 > 08f712f06a98.8081: Flags [.], ack 1, win 507, options [nop,nop,TS val 1882619919 ecr 1637634231], length 0
E..4..@.>.c.,...	....@.......qf.....7,.....
p6..a.P.
14:47:18.389006 IP 44.128.0.3.41792 > 08f712f06a98.8081: Flags [P.], seq 1:225, ack 1, win 507, options [nop,nop,TS val 1882619920 ecr 1637634231], length 224
E.....@.>.c
,...	....@.......qf.....8......
p6..a.P.GET /api/artists/search?artist=alt-J HTTP/1.1
Accept: */*
User-Agent: Restler for node.js
Host: searchservice.marathon.l4lb.thisdcos.directory:8081
Accept-Encoding: gzip, deflate
Content-Length: 0
Connection: close


14:47:18.389045 IP 08f712f06a98.8081 > 44.128.0.3.41792: Flags [.], ack 225, win 502, options [nop,nop,TS val 1637634232 ecr 1882619920], length 0
E..4..@.@...	...,......@.qf.........7,.....
a.P.p6..
14:47:18.390339 IP 08f712f06a98.8081 > 44.128.0.3.41792: Flags [P.], seq 1:109, ack 225, win 502, options [nop,nop,TS val 1637634233 ecr 1882619920], length 108
E.....@.@...	...,......@.qf.........7......
a.P.p6..HTTP/1.1 200 OK
Date: Sat, 13 Nov 2021 14:47:18 GMT
Content-type: application/json
Content-length: 46


14:47:18.390577 IP 44.128.0.3.41792 > 08f712f06a98.8081: Flags [.], ack 109, win 507, options [nop,nop,TS val 1882619921 ecr 1637634233], length 0
E..4..@.>.c.,...	....@.......qgh....7,.....
p6..a.P.
14:47:18.390624 IP 08f712f06a98.8081 > 44.128.0.3.41792: Flags [P.], seq 109:155, ack 225, win 502, options [nop,nop,TS val 1637634233 ecr 1882619921], length 46
E..b..@.@...	...,......@.qgh........7Z.....
a.P.p6..{"id":"3XHO7cRUPCLOr6jwp8vsx5","name":"alt-J"}
14:47:18.390819 IP 44.128.0.3.41792 > 08f712f06a98.8081: Flags [.], ack 155, win 507, options [nop,nop,TS val 1882619922 ecr 1637634233], length 0
E..4..@.>.c.,...	....@.......qg.....7,.....
p6..a.P.
14:47:18.391190 IP 08f712f06a98.8081 > 44.128.0.3.41792: Flags [F.], seq 155, ack 225, win 502, options [nop,nop,TS val 1637634234 ecr 1882619922], length 0
E..4..@.@...	...,......@.qg.........7,.....
a.P.p6..
14:47:18.391338 IP 44.128.0.3.41792 > 08f712f06a98.8081: Flags [F.], seq 225, ack 155, win 507, options [nop,nop,TS val 1882619922 ecr 1637634233], length 0
E..4..@.>.c.,...	....@.......qg.....7,.....
p6..a.P.
14:47:18.391365 IP 08f712f06a98.8081 > 44.128.0.3.41792: Flags [.], ack 226, win 502, options [nop,nop,TS val 1637634234 ecr 1882619922], length 0
E..4..@.@...	...,......@.qg.........7,.....
a.P.p6..
14:47:18.391519 IP 44.128.0.3.41792 > 08f712f06a98.8081: Flags [.], ack 156, win 507, options [nop,nop,TS val 1882619922 ecr 1637634234], length 0
E..4..@.>.c.,...	....@.......qg.....7,.....
p6..a.P.
14:47:42.686247 IP 44.128.0.3.53462 > 08f712f06a98.8081: Flags [S], seq 1026618466, win 64860, options [mss 1380,sackOK,TS val 3144530013 ecr 0,nop,wscale 7], length 0
E..</.@.>...,...	.......=0.b.......\74.....d...
.m.]........
14:47:42.686301 IP 08f712f06a98.8081 > 44.128.0.3.53462: Flags [S.], seq 3455315123, ack 1026618467, win 64296, options [mss 1380,sackOK,TS val 1637658529 ecr 3144530013,nop,wscale 7], length 0
E..<..@.@...	...,...........=0.c...(74.....d...
a....m.]....
14:47:42.686538 IP 44.128.0.3.53462 > 08f712f06a98.8081: Flags [.], ack 1, win 507, options [nop,nop,TS val 3144530013 ecr 1637658529], length 0
E..4/.@.>...,...	.......=0.c........7,.....
.m.]a...
14:47:42.686805 IP 44.128.0.3.53462 > 08f712f06a98.8081: Flags [P.], seq 1:238, ack 1, win 507, options [nop,nop,TS val 3144530014 ecr 1637658529], length 237
E..!/.@.>...,...	.......=0.c........8......
.m.^a...GET /api/artists/search?artist=%22sonu%20nigam%22 HTTP/1.1
Accept: */*
User-Agent: Restler for node.js
Host: searchservice.marathon.l4lb.thisdcos.directory:8081
Accept-Encoding: gzip, deflate
Content-Length: 0
Connection: close


14:47:42.686868 IP 08f712f06a98.8081 > 44.128.0.3.53462: Flags [.], ack 238, win 502, options [nop,nop,TS val 1637658530 ecr 3144530014], length 0
E..4h:@.@...	...,...........=0.P....7,.....
a....m.^
14:47:42.688566 IP 08f712f06a98.52216 > 25.443: Flags [P.], seq 3377103865:3377103896, ack 4102839853, win 502, options [nop,nop,TS val 1134405768 ecr 17854493], length 31
E..S.e@.@.4.	...#........J....^-...........
C.....p...............[.....g.......@f.
14:47:42.689011 IP 08f712f06a98.52216 > 25.443: Flags [F.], seq 31, ack 1, win 502, options [nop,nop,TS val 1134405769 ecr 17854493], length 0
E..4.f@.@.5.	...#........J....^-.....}.....
C.....p.
14:47:42.689362 IP 08f712f06a98.34652 > 198.51.100.1.53: 51954+ PTR? 25.224.186.35.in-addr.arpa. (44)
E..HQV@.@...	....3d..\.5.44..............25.224.186.35.in-addr.arpa.....
14:47:42.701241 IP 198.51.100.1.53 > 08f712f06a98.34652: 51954 1/0/0 PTR 25.224.186.35.bc.googleusercontent.com. (96)
E..|..@.@.K..3d.	....5.\.h51.............25.224.186.35.in-addr.arpa..............t.(.25.224.186.35.bc.googleusercontent.com.
14:47:42.703689 IP 08f712f06a98.52216 > 25.443: Flags [F.], seq 31, ack 1, win 502, options [nop,nop,TS val 1134405784 ecr 17854493], length 0
E..4.g@.@.5.	...#........J....^-.....}.....
C.....p.
14:47:42.784378 IP 08f712f06a98.35235 > 198.51.100.1.53: 14454+ A? api.spotify.com. (33)
E..=Q`@.@...	....3d....5.)4.8v...........api.spotify.com.....
14:47:42.816053 IP 198.51.100.1.53 > 08f712f06a98.35235: 14454 2/0/0 CNAME edge-web.dual-gslb.spotify.com., A 35.186.224.25 (82)
E..n..@.@.K..3d.	....5...Z5#8v...........api.spotify.com..............c...edge-web	dual-gslb...-.......!..#...
14:47:42.816606 IP 08f712f06a98.33782 > 25.443: Flags [S], seq 117102477, win 64860, options [mss 1380,sackOK,TS val 1134405896 ecr 0,nop,wscale 7], length 0
E..<d.@.@...	...#..................\.......d...
C...........
14:47:42.817133 IP 25.443 > 08f712f06a98.33782: Flags [S.], seq 937365504, ack 117102478, win 14480, options [mss 1460,sackOK,TS val 17959632 ecr 1134405896,nop,wscale 7], length 0
E..<.
@.4.h[#...	.......7.........8.\h.........
..
.C.......
14:47:42.817169 IP 08f712f06a98.33782 > 25.443: Flags [.], ack 1, win 507, options [nop,nop,TS val 1134405897 ecr 17959632], length 0
E..4d.@.@...	...#...........7........}.....
C..	..
.
14:47:42.818350 IP 08f712f06a98.33782 > 25.443: Flags [P.], seq 1:275, ack 1, win 507, options [nop,nop,TS val 1134405898 ecr 17959632], length 274
E..Fd.@.@...	...#...........7..............
C..
..
.........	..a......w..#.:....M..S}.......... <A.....
hA.b\..~@..1g".)Bf.....h.d.$.(.=.&.*.k.j.
...5.....9.8.#.'.<.%.).g.@.	.../.....3.2.,.+.0.....2...../...-.1.........
.............\.
...........	.
.............................................................api.spotify.com
14:47:42.818907 IP 25.443 > 08f712f06a98.33782: Flags [.], ack 275, win 122, options [nop,nop,TS val 17959632 ecr 1134405898], length 0
E..4..@.4...#...	.......7..........z.6.....
..
.C..

14:47:42.867986 IP 25.443 > 08f712f06a98.33782: Flags [P.], seq 1:148, ack 275, win 122, options [nop,nop,TS val 17959637 ecr 1134405898], length 147
E.....@.4..	#...	.......7..........z.......
..
.C..
....[...W..a.....[.....|..l..[/.(KjDOWNGRD. <A.....
hA.b\..~@..1g".)Bf.....h./............................(........J...]..K..|...D9k.LU=w..v.....i.
14:47:42.868012 IP 08f712f06a98.33782 > 25.443: Flags [.], ack 148, win 506, options [nop,nop,TS val 1134405948 ecr 17959637], length 0
E..4d.@.@...	...#...........7........}.....
C..<..
.
14:47:42.868686 IP 08f712f06a98.33782 > 25.443: Flags [P.], seq 275:281, ack 148, win 506, options [nop,nop,TS val 1134405949 ecr 17959637], length 6
E..:d.@.@...	...#...........7..............
C..=..
.......
14:47:42.868887 IP 08f712f06a98.33782 > 25.443: Flags [P.], seq 281:326, ack 148, win 506, options [nop,nop,TS val 1134405949 ecr 17959637], length 45
E..ad.@.@..v	...#...........7..............
C..=..
.....(........j.:c.F.,...A.......k......=.'...
14:47:42.869196 IP 25.443 > 08f712f06a98.33782: Flags [.], ack 281, win 122, options [nop,nop,TS val 17959637 ecr 1134405949], length 0
E..4..@.4...#...	.......7..........z.e.....
..
.C..=
14:47:42.869201 IP 08f712f06a98.33782 > 25.443: Flags [P.], seq 326:718, ack 148, win 506, options [nop,nop,TS val 1134405949 ecr 17959637], length 392
E...d.@.@...	...#...........7..............
C..=..
................o.9...-....O.,..}#.......o~-...........,...1b~..Wa...,.....E......N.b9..tI5....\...l...N	.+.!..<...3n	-O..Y.. ......*....H....!..w.?.......3....z._....SUS[...#=kl......b+.I.l..
....>...9}'..*..R(}.uQ...:............&n#...7..q<E.&...R...+-.!>.[.&..KO...:.[..*.[.F...\.E..~A..........
.:..!....O..!Y...%../ ZA|,.+...Y...q.`t.$.x.....g. z$....cw.p_.....5.a...M.p.$y.#.^\.....D6+l.
14:47:42.869250 IP 25.443 > 08f712f06a98.33782: Flags [.], ack 326, win 122, options [nop,nop,TS val 17959637 ecr 1134405949], length 0
E..4..@.4...#...	.......7..........z.8.....
..
.C..=
14:47:42.869547 IP 25.443 > 08f712f06a98.33782: Flags [.], ack 718, win 130, options [nop,nop,TS val 17959637 ecr 1134405949], length 0
E..4..@.4...#...	.......7......[...........
..
.C..=
14:47:42.911724 IP 08f712f06a98.52216 > 25.443: Flags [FP.], seq 0:31, ack 1, win 502, options [nop,nop,TS val 1134405992 ecr 17854493], length 31
E..S.h@.@.4.	...#........J....^-...........
C..h..p...............[.....g.......@f.
14:47:42.930906 IP 25.443 > 08f712f06a98.33782: Flags [P.], seq 148:1559, ack 718, win 130, options [nop,nop,TS val 17959643 ecr 1134405949], length 1411
E.....@.4...#...	.......7......[...........
..
.C..=....~.........E...&4....ro..P\.q.?.5.@....k..O..8z".e....PZ.....h...W}0...C..Zy.su...}&.\.:...-Zrf...la.z....y.V,....+b8.6.T7....D.hz..T.%t.3%...a..r...%x.v..f..x#i%.c.a..->"iE......&X..>f......GU..2.Yn.!|..r.........]..........K..H....`....m?mG.......
.7.....Ga......()......Cs.).......}.2.DNI.(r.J.h|..>.4.c...X.2.7S..-n.,b.\....C..C..)_.I<..;.+.;,.\.'... vSm..u.l...Y.>.QK..sY.....'..a$.yO3Src.Z!;..f.w...fw.....h..a.~...(m..}..z...8.S.`pY\.S.6(........5. ..[..'....P...\.$	;s%.S#..J.*.m..w5...Gv..hm..
d..V.4J[T.....k. .@....a{1..T..)S'y..?9...4..ZK....1......3.t
.IZ%2......n..	h..tv..e....z...?."o.H-X....I. ...l...?v.....X..3N..+.(i~..;...jv..x\{..~H..........}.......~e...xG.p.}./W?..y..J....yO.|.q0J...^...cY...u.l..?.....t....m...^.pt?o.2......l..U}.Ym..1.q+....Gp.....Y5.uT...cg......J../.d.geTB....R`.WD
.~&.}Gw0)....,.$.*+..	.e...z..D....."[i4..>....B.....;f......:...D..m..m\.+.....%.-!.|.A..s|....QM....e~v*.9\]!.\..-..C.k...
.3..............].].....E~F#P...|..f..N)[..`...[.......h%..L....$!(..}7.><.L.".{.O.....O.x.>.9z..`.c...M-........^L........qPr............$.....&XE....bLw.
.9..l....(.0Y.L%$..@B...Y"....*.V..!.:5.U........
v...|q.]...F<z...>r+..`?....c...f{o.k..>...S..B.^>....|..!<...S..wH*...`.9.o..!.V........=..r....:..T..[#.&..XB......!....{.u^Qn..W.{..3.3......x[..T.Y...9........I3)$....C...->...[..o-..k......b~..+...D?..#.	2.(C.n$rD6.:........$.g.Ja...)d......U.H.."..7....pt..s
14:47:42.930939 IP 08f712f06a98.33782 > 25.443: Flags [.], ack 1559, win 501, options [nop,nop,TS val 1134406011 ecr 17959643], length 0
E..4d.@.@...	...#..........[7........}.....
C..{..
.
14:47:42.930914 IP 25.443 > 08f712f06a98.33782: Flags [P.], seq 1559:1593, ack 718, win 130, options [nop,nop,TS val 17959643 ecr 1134405949], length 34
E..V..@.4..t#...	.......7......[...........
..
.C..=.............(D6!j.Y.d..K.K0XT....
14:47:42.930955 IP 08f712f06a98.33782 > 25.443: Flags [.], ack 1593, win 501, options [nop,nop,TS val 1134406011 ecr 17959643], length 0
E..4d.@.@...	...#..........[7..9.....}.....
C..{..
.
14:47:42.932768 IP 08f712f06a98.8081 > 44.128.0.3.53462: Flags [P.], seq 1:109, ack 238, win 502, options [nop,nop,TS val 1637658776 ecr 3144530014], length 108
E...h;@.@...	...,...........=0.P....7......
a....m.^HTTP/1.1 200 OK
Date: Sat, 13 Nov 2021 14:47:42 GMT
Content-type: application/json
Content-length: 51


14:47:42.933068 IP 44.128.0.3.53462 > 08f712f06a98.8081: Flags [.], ack 109, win 507, options [nop,nop,TS val 3144530260 ecr 1637658776], length 0
E..4/.@.>...,...	.......=0.P... ....7,.....
.m.Ta...
14:47:42.933118 IP 08f712f06a98.8081 > 44.128.0.3.53462: Flags [P.], seq 109:160, ack 238, win 502, options [nop,nop,TS val 1637658776 ecr 3144530260], length 51
E..gh<@.@..O	...,.......... =0.P....7_.....
a....m.T{"id":"1dVygo6tRFXC8CSWURQJq2","name":"Sonu Nigam"}
14:47:42.933336 IP 44.128.0.3.53462 > 08f712f06a98.8081: Flags [.], ack 160, win 507, options [nop,nop,TS val 3144530260 ecr 1637658776], length 0
E..4/.@.>...,...	.......=0.P...S....7,.....
.m.Ta...
14:47:42.933835 IP 44.128.0.3.53462 > 08f712f06a98.8081: Flags [F.], seq 238, ack 160, win 507, options [nop,nop,TS val 3144530261 ecr 1637658776], length 0
E..4/.@.>...,...	.......=0.P...S....7,.....
.m.Ua...
14:47:42.933866 IP 08f712f06a98.8081 > 44.128.0.3.53462: Flags [F.], seq 160, ack 238, win 502, options [nop,nop,TS val 1637658777 ecr 3144530260], length 0
E..4h=@.@...	...,..........S=0.P....7,.....
a....m.T
14:47:42.934103 IP 44.128.0.3.53462 > 08f712f06a98.8081: Flags [.], ack 161, win 507, options [nop,nop,TS val 3144530261 ecr 1637658777], length 0
E..4/.@.>...,...	.......=0.Q...T....7,.....
.m.Ua...
14:47:42.934136 IP 08f712f06a98.8081 > 44.128.0.3.53462: Flags [.], ack 239, win 502, options [nop,nop,TS val 1637658777 ecr 3144530261], length 0
E..4h>@.@...	...,..........T=0.Q....7,.....
a....m.U
14:47:43.331703 IP 08f712f06a98.52216 > 25.443: Flags [FP.], seq 0:31, ack 1, win 502, options [nop,nop,TS val 1134406412 ecr 17854493], length 31
E..S.i@.@.4.	...#........J....^-...........
C.....p...............[.....g.......@f.
14:47:44.159724 IP 08f712f06a98.52216 > 25.443: Flags [FP.], seq 0:31, ack 1, win 502, options [nop,nop,TS val 1134407240 ecr 17854493], length 31
E..S.j@.@.4.	...#........J....^-...........
C..H..p...............[.....g.......@f.
14:47:44.645229 IP 44.128.0.3.53502 > 08f712f06a98.8081: Flags [S], seq 3581156568, win 64860, options [mss 1380,sackOK,TS val 3144531972 ecr 0,nop,wscale 7], length 0
E..<..@.>.;.,...	........t.........\74.....d...
.m..........
14:47:44.645260 IP 08f712f06a98.8081 > 44.128.0.3.53502: Flags [S.], seq 3218153927, ack 3581156569, win 64296, options [mss 1380,sackOK,TS val 1637660488 ecr 3144531972,nop,wscale 7], length 0
E..<..@.@...	...,.........!..t.....(74.....d...
a..H.m......
14:47:44.645412 IP 44.128.0.3.53502 > 08f712f06a98.8081: Flags [.], ack 1, win 507, options [nop,nop,TS val 3144531972 ecr 1637660488], length 0
E..4..@.>.;.,...	........t....!.....7,.....
.m..a..H
14:47:44.646121 IP 44.128.0.3.53502 > 08f712f06a98.8081: Flags [P.], seq 1:225, ack 1, win 507, options [nop,nop,TS val 3144531973 ecr 1637660488], length 224
E.....@.>.:.,...	........t....!.....8......
.m..a..HGET /api/artists/search?artist=alt-J HTTP/1.1
Accept: */*
User-Agent: Restler for node.js
Host: searchservice.marathon.l4lb.thisdcos.directory:8081
Accept-Encoding: gzip, deflate
Content-Length: 0
Connection: close


14:47:44.646146 IP 08f712f06a98.8081 > 44.128.0.3.53502: Flags [.], ack 225, win 502, options [nop,nop,TS val 1637660489 ecr 3144531973], length 0
E..4.P@.@.mn	...,.........!..t......7,.....
a..I.m..
14:47:44.787316 IP 08f712f06a98.8081 > 44.128.0.3.53502: Flags [P.], seq 1:109, ack 225, win 502, options [nop,nop,TS val 1637660630 ecr 3144531973], length 108
E....Q@.@.m.	...,.........!..t......7......
a....m..HTTP/1.1 200 OK
Date: Sat, 13 Nov 2021 14:47:44 GMT
Content-type: application/json
Content-length: 46


14:47:44.787604 IP 44.128.0.3.53502 > 08f712f06a98.8081: Flags [.], ack 109, win 507, options [nop,nop,TS val 3144532114 ecr 1637660630], length 0
E..4..@.>.;.,...	........t...."4....7,.....
.m..a...
14:47:44.787663 IP 08f712f06a98.8081 > 44.128.0.3.53502: Flags [P.], seq 109:155, ack 225, win 502, options [nop,nop,TS val 1637660630 ecr 3144532114], length 46
E..b.R@.@.m>	...,........."4.t......7Z.....
a....m..{"id":"3XHO7cRUPCLOr6jwp8vsx5","name":"alt-J"}
14:47:44.787894 IP 44.128.0.3.53502 > 08f712f06a98.8081: Flags [.], ack 155, win 507, options [nop,nop,TS val 3144532115 ecr 1637660630], length 0
E..4..@.>.;.,...	........t...."b....7,.....
.m..a...
14:47:44.788442 IP 08f712f06a98.8081 > 44.128.0.3.53502: Flags [F.], seq 155, ack 225, win 502, options [nop,nop,TS val 1637660631 ecr 3144532115], length 0
E..4.S@.@.mk	...,........."b.t......7,.....
a....m..
14:47:44.788540 IP 44.128.0.3.53502 > 08f712f06a98.8081: Flags [F.], seq 225, ack 155, win 507, options [nop,nop,TS val 3144532115 ecr 1637660630], length 0
E..4..@.>.;.,...	........t...."b....7,.....
.m..a...
14:47:44.788650 IP 44.128.0.3.53502 > 08f712f06a98.8081: Flags [.], ack 156, win 507, options [nop,nop,TS val 3144532115 ecr 1637660631], length 0
E..4..@.>.;.,...	........t...."c....7,.....
.m..a...
14:47:44.788690 IP 08f712f06a98.8081 > 44.128.0.3.53502: Flags [.], ack 226, win 502, options [nop,nop,TS val 1637660632 ecr 3144532115], length 0
E..4.T@.@.mj	...,........."c.t......7,.....
a....m..
14:47:45.823708 IP 08f712f06a98.52216 > 25.443: Flags [FP.], seq 0:31, ack 1, win 502, options [nop,nop,TS val 1134408904 ecr 17854493], length 31
E..S.k@.@.4.	...#........J....^-...........
C.....p...............[.....g.......@f.
14:47:49.187714 IP 08f712f06a98.52216 > 25.443: Flags [FP.], seq 0:31, ack 1, win 502, options [nop,nop,TS val 1134412268 ecr 17854493], length 31
E..S.l@.@.4.	...#........J....^-...........
C.....p...............[.....g.......@f.
14:47:55.839705 IP 08f712f06a98.52216 > 25.443: Flags [FP.], seq 0:31, ack 1, win 502, options [nop,nop,TS val 1134418920 ecr 17854493], length 31
E..S.m@.@.4.	...#........J....^-...........
C.....p...............[.....g.......@f.
14:47:55.857043 IP 44.128.0.3.42336 > 08f712f06a98.8081: Flags [S], seq 1229045335, win 64860, options [mss 1380,sackOK,TS val 1882657388 ecr 0,nop,wscale 7], length 0
E..<\&@.>...,...	....`..IA.W.......\74.....d...
p7.l........
14:47:55.857075 IP 08f712f06a98.8081 > 44.128.0.3.42336: Flags [S.], seq 16381065, ack 1229045336, win 64296, options [mss 1380,sackOK,TS val 1637671700 ecr 1882657388,nop,wscale 7], length 0
E..<..@.@...	...,......`....IA.X...(74.....d...
a...p7.l....
14:47:55.857202 IP 44.128.0.3.42336 > 08f712f06a98.8081: Flags [.], ack 1, win 507, options [nop,nop,TS val 1882657388 ecr 1637671700], length 0
E..4\'@.>...,...	....`..IA.X........7,.....
p7.la...
14:47:55.857800 IP 44.128.0.3.42336 > 08f712f06a98.8081: Flags [P.], seq 1:225, ack 1, win 507, options [nop,nop,TS val 1882657389 ecr 1637671700], length 224
E...\(@.>...,...	....`..IA.X........8......
p7.ma...GET /api/artists/search?artist=alt-J HTTP/1.1
Accept: */*
User-Agent: Restler for node.js
Host: searchservice.marathon.l4lb.thisdcos.directory:8081
Accept-Encoding: gzip, deflate
Content-Length: 0
Connection: close


14:47:55.857821 IP 08f712f06a98.8081 > 44.128.0.3.42336: Flags [.], ack 225, win 502, options [nop,nop,TS val 1637671701 ecr 1882657389], length 0
E..4.n@.@..P	...,......`....IA.8....7,.....
a...p7.m
14:47:55.858602 IP 08f712f06a98.8081 > 44.128.0.3.42336: Flags [P.], seq 1:109, ack 225, win 502, options [nop,nop,TS val 1637671701 ecr 1882657389], length 108
E....o@.@...	...,......`....IA.8....7......
a...p7.mHTTP/1.1 200 OK
Date: Sat, 13 Nov 2021 14:47:55 GMT
Content-type: application/json
Content-length: 46


14:47:55.858725 IP 44.128.0.3.42336 > 08f712f06a98.8081: Flags [.], ack 109, win 507, options [nop,nop,TS val 1882657390 ecr 1637671701], length 0
E..4\)@.>...,...	....`..IA.8........7,.....
p7.na...
14:47:55.858838 IP 08f712f06a98.8081 > 44.128.0.3.42336: Flags [P.], seq 109:155, ack 225, win 502, options [nop,nop,TS val 1637671702 ecr 1882657390], length 46
E..b.p@.@.. 	...,......`....IA.8....7Z.....
a...p7.n{"id":"3XHO7cRUPCLOr6jwp8vsx5","name":"alt-J"}
14:47:55.858925 IP 44.128.0.3.42336 > 08f712f06a98.8081: Flags [.], ack 155, win 507, options [nop,nop,TS val 1882657390 ecr 1637671702], length 0
E..4\*@.>...,...	....`..IA.8...$....7,.....
p7.na...
14:47:55.859091 IP 44.128.0.3.42336 > 08f712f06a98.8081: Flags [F.], seq 225, ack 155, win 507, options [nop,nop,TS val 1882657390 ecr 1637671702], length 0
E..4\+@.>...,...	....`..IA.8...$....7,.....
p7.na...
14:47:55.859359 IP 08f712f06a98.8081 > 44.128.0.3.42336: Flags [F.], seq 155, ack 226, win 502, options [nop,nop,TS val 1637671702 ecr 1882657390], length 0
E..4.q@.@..M	...,......`...$IA.9....7,.....
a...p7.n
14:47:55.859522 IP 44.128.0.3.42336 > 08f712f06a98.8081: Flags [.], ack 156, win 507, options [nop,nop,TS val 1882657390 ecr 1637671702], length 0
E..4\,@.>...,...	....`..IA.9...%....7,.....
p7.na...
14:48:09.151703 IP 08f712f06a98.52216 > 25.443: Flags [FP.], seq 0:31, ack 1, win 502, options [nop,nop,TS val 1134432232 ecr 17854493], length 31
E..S.n@.@.4.	...#........J....^-...........
C.....p...............[.....g.......@f.
14:48:10.805589 IP 44.128.0.3.53684 > 08f712f06a98.8081: Flags [S], seq 3690071565, win 64860, options [mss 1380,sackOK,TS val 3144558132 ecr 0,nop,wscale 7], length 0
E..<..@.>.K.,...	..................\74.....d...
.n&4........
14:48:10.805642 IP 08f712f06a98.8081 > 44.128.0.3.53684: Flags [S.], seq 4004885936, ack 3690071566, win 64296, options [mss 1380,sackOK,TS val 1637686648 ecr 3144558132,nop,wscale 7], length 0
E..<..@.@...	...,..................(74.....d...
a..x.n&4....
14:48:10.805874 IP 44.128.0.3.53684 > 08f712f06a98.8081: Flags [.], ack 1, win 507, options [nop,nop,TS val 3144558133 ecr 1637686648], length 0
E..4..@.>.K.,...	...................7,.....
.n&5a..x
14:48:10.806126 IP 44.128.0.3.53684 > 08f712f06a98.8081: Flags [P.], seq 1:225, ack 1, win 507, options [nop,nop,TS val 3144558133 ecr 1637686648], length 224
E.....@.>.J.,...	...................8......
.n&5a..xGET /api/artists/search?artist=alt-J HTTP/1.1
Accept: */*
User-Agent: Restler for node.js
Host: searchservice.marathon.l4lb.thisdcos.directory:8081
Accept-Encoding: gzip, deflate
Content-Length: 0
Connection: close


14:48:10.806160 IP 08f712f06a98.8081 > 44.128.0.3.53684: Flags [.], ack 225, win 502, options [nop,nop,TS val 1637686649 ecr 3144558133], length 0
E..4th@.@..V	...,...................7,.....
a..y.n&5
14:48:10.807472 IP 08f712f06a98.8081 > 44.128.0.3.53684: Flags [P.], seq 1:109, ack 225, win 502, options [nop,nop,TS val 1637686650 ecr 3144558133], length 108
E...ti@.@...	...,...................7......
a..z.n&5HTTP/1.1 200 OK
Date: Sat, 13 Nov 2021 14:48:10 GMT
Content-type: application/json
Content-length: 46


14:48:10.807732 IP 44.128.0.3.53684 > 08f712f06a98.8081: Flags [.], ack 109, win 507, options [nop,nop,TS val 3144558134 ecr 1637686650], length 0
E..4..@.>.K.,...	...................7,.....
.n&6a..z
14:48:10.807789 IP 08f712f06a98.8081 > 44.128.0.3.53684: Flags [P.], seq 109:155, ack 225, win 502, options [nop,nop,TS val 1637686651 ecr 3144558134], length 46
E..btj@.@..&	...,...................7Z.....
a..{.n&6{"id":"3XHO7cRUPCLOr6jwp8vsx5","name":"alt-J"}
14:48:10.807931 IP 44.128.0.3.53684 > 08f712f06a98.8081: Flags [.], ack 155, win 507, options [nop,nop,TS val 3144558135 ecr 1637686651], length 0
E..4..@.>.K.,...	..............K....7,.....
.n&7a..{
14:48:10.808157 IP 44.128.0.3.53684 > 08f712f06a98.8081: Flags [F.], seq 225, ack 155, win 507, options [nop,nop,TS val 3144558135 ecr 1637686651], length 0
E..4..@.>.K.,...	..............K....7,.....
.n&7a..{
14:48:10.808322 IP 08f712f06a98.8081 > 44.128.0.3.53684: Flags [F.], seq 155, ack 226, win 502, options [nop,nop,TS val 1637686651 ecr 3144558135], length 0
E..4tk@.@..S	...,..........K........7,.....
a..{.n&7
14:48:10.808512 IP 44.128.0.3.53684 > 08f712f06a98.8081: Flags [.], ack 156, win 507, options [nop,nop,TS val 3144558135 ecr 1637686651], length 0
E..4..@.>.K.,...	..............L....7,.....
.n&7a..{
