tcpdump: verbose output suppressed, use -v or -vv for full protocol decode
listening on eth0, link-type EN10MB (Ethernet), capture size 262144 bytes
14:45:54.922605 IP 44.128.0.3.41254 > fcb112782daa.8081: Flags [S], seq 525669360, win 64860, options [mss 1380,sackOK,TS val 1882536453 ecr 0,nop,wscale 7], length 0
E..<..@.>.o.,...	....&...U.........\73.....d...
p5:.........
14:45:54.922634 IP fcb112782daa.8081 > 44.128.0.3.41254: Flags [S.], seq 3721430350, ack 525669361, win 64296, options [mss 1380,sackOK,TS val 3398289550 ecr 1882536453,nop,wscale 7], length 0
E..<..@.@...	...,......&...N.U.....(73.....d...
....p5:.....
14:45:54.922729 IP 44.128.0.3.41254 > fcb112782daa.8081: Flags [.], ack 1, win 507, options [nop,nop,TS val 1882536454 ecr 3398289550], length 0
E..4..@.>.o$,...	....&...U.....O....7+.....
p5:.....
14:45:54.923035 IP 44.128.0.3.41254 > fcb112782daa.8081: Flags [P.], seq 1:235, ack 1, win 507, options [nop,nop,TS val 1882536454 ecr 3398289550], length 234
E.....@.>.n9,...	....&...U.....O....8......
p5:.....GET /api/tracks/search?title=Nara&artist=alt-J HTTP/1.1
Accept: */*
User-Agent: Restler for node.js
Host: searchservice.marathon.l4lb.thisdcos.directory:8081
Accept-Encoding: gzip, deflate
Content-Length: 0
Connection: close


14:45:54.923050 IP fcb112782daa.8081 > 44.128.0.3.41254: Flags [.], ack 235, win 502, options [nop,nop,TS val 3398289551 ecr 1882536454], length 0
E..4..@.@...	...,......&...O.U......7+.....
....p5:.
14:45:54.938205 IP fcb112782daa.54990 > 198.51.100.1.53: 30877+ PTR? 3.0.128.44.in-addr.arpa. (41)
E..E..@.@..B	....3d....5.14.x............3.0.128.44.in-addr.arpa.....
14:45:54.965476 IP 198.51.100.1.53 > fcb112782daa.54990: 30877 NXDomain 0/1/0 (96)
E..|..@.@.:..3d.	....5...h50x............3.0.128.44.in-addr.arpa................+.ampr.org.
hostmaster.5}.Nm..........u.....
14:45:54.966377 IP fcb112782daa.59380 > 198.51.100.1.53: 1830+ PTR? 1.100.51.198.in-addr.arpa. (43)
E..G..@.@..;	....3d....5.34..&...........1.100.51.198.in-addr.arpa.....
14:45:54.978576 IP 198.51.100.1.53 > fcb112782daa.59380: 1830 NXDomain 0/1/0 (97)
E..}..@.@.:..3d.	....5...i51.&...........1.100.51.198.in-addr.arpa................*.z.arin.net..dns-ops.9x9y..........
....*0
14:45:55.028991 IP fcb112782daa.8081 > 44.128.0.3.41254: Flags [P.], seq 1:108, ack 235, win 502, options [nop,nop,TS val 3398289657 ecr 1882536454], length 107
E.....@.@...	...,......&...O.U......7......
....p5:.HTTP/1.1 200 OK
Date: Sat, 13 Nov 2021 14:45:55 GMT
Content-type: application/json
Content-length: 2


14:45:55.029244 IP 44.128.0.3.41254 > fcb112782daa.8081: Flags [.], ack 108, win 507, options [nop,nop,TS val 1882536560 ecr 3398289657], length 0
E..4..@.>.o",...	....&...U..........7+.....
p5:p....
14:45:55.029311 IP fcb112782daa.8081 > 44.128.0.3.41254: Flags [P.], seq 108:110, ack 235, win 502, options [nop,nop,TS val 3398289657 ecr 1882536560], length 2
E..6..@.@...	...,......&.....U......7-.....
....p5:p{}
14:45:55.029485 IP 44.128.0.3.41254 > fcb112782daa.8081: Flags [.], ack 110, win 507, options [nop,nop,TS val 1882536560 ecr 3398289657], length 0
E..4..@.>.o!,...	....&...U..........7+.....
p5:p....
14:45:55.029877 IP fcb112782daa.8081 > 44.128.0.3.41254: Flags [F.], seq 110, ack 235, win 502, options [nop,nop,TS val 3398289658 ecr 1882536560], length 0
E..4..@.@...	...,......&.....U......7+.....
....p5:p
14:45:55.029885 IP 44.128.0.3.41254 > fcb112782daa.8081: Flags [F.], seq 235, ack 110, win 507, options [nop,nop,TS val 1882536561 ecr 3398289657], length 0
E..4..@.>.o ,...	....&...U..........7+.....
p5:q....
14:45:55.030097 IP 44.128.0.3.41254 > fcb112782daa.8081: Flags [.], ack 111, win 507, options [nop,nop,TS val 1882536561 ecr 3398289658], length 0
E..4..@.>.o.,...	....&...U..........7+.....
p5:q....
14:45:55.030134 IP fcb112782daa.8081 > 44.128.0.3.41254: Flags [.], ack 236, win 502, options [nop,nop,TS val 3398289658 ecr 1882536561], length 0
E..4..@.@...	...,......&.....U......7+.....
....p5:q
14:46:07.162022 IP 44.128.0.3.52576 > fcb112782daa.8081: Flags [S], seq 2687089269, win 64860, options [mss 1380,sackOK,TS val 3144434489 ecr 0,nop,wscale 7], length 0
E..<..@.>...,...	....`...).u.......\73.....d...
.lC9........
14:46:07.162069 IP fcb112782daa.8081 > 44.128.0.3.52576: Flags [S.], seq 3172772770, ack 2687089270, win 64296, options [mss 1380,sackOK,TS val 3398301790 ecr 3144434489,nop,wscale 7], length 0
E..<..@.@...	...,......`.....).v...(73.....d...
...^.lC9....
14:46:07.162274 IP 44.128.0.3.52576 > fcb112782daa.8081: Flags [.], ack 1, win 507, options [nop,nop,TS val 3144434489 ecr 3398301790], length 0
E..4..@.>...,...	....`...).v........7+.....
.lC9...^
14:46:07.162457 IP 44.128.0.3.52576 > fcb112782daa.8081: Flags [P.], seq 1:235, ack 1, win 507, options [nop,nop,TS val 3144434489 ecr 3398301790], length 234
E.....@.>...,...	....`...).v........8......
.lC9...^GET /api/tracks/search?title=Nara&artist=alt-J HTTP/1.1
Accept: */*
User-Agent: Restler for node.js
Host: searchservice.marathon.l4lb.thisdcos.directory:8081
Accept-Encoding: gzip, deflate
Content-Length: 0
Connection: close


14:46:07.162472 IP fcb112782daa.8081 > 44.128.0.3.52576: Flags [.], ack 235, win 502, options [nop,nop,TS val 3398301790 ecr 3144434489], length 0
E..4BH@.@..w	...,......`.....).`....7+.....
...^.lC9
14:46:07.329827 IP fcb112782daa.8081 > 44.128.0.3.52576: Flags [P.], seq 1:108, ack 235, win 502, options [nop,nop,TS val 3398301958 ecr 3144434489], length 107
E...BI@.@...	...,......`.....).`....7......
.....lC9HTTP/1.1 200 OK
Date: Sat, 13 Nov 2021 14:46:07 GMT
Content-type: application/json
Content-length: 2


14:46:07.330100 IP 44.128.0.3.52576 > fcb112782daa.8081: Flags [.], ack 108, win 507, options [nop,nop,TS val 3144434657 ecr 3398301958], length 0
E..4..@.>...,...	....`...).`........7+.....
.lC.....
14:46:07.330156 IP fcb112782daa.8081 > 44.128.0.3.52576: Flags [P.], seq 108:110, ack 235, win 502, options [nop,nop,TS val 3398301958 ecr 3144434657], length 2
E..6BJ@.@..s	...,......`.....).`....7-.....
.....lC.{}
14:46:07.330332 IP 44.128.0.3.52576 > fcb112782daa.8081: Flags [.], ack 110, win 507, options [nop,nop,TS val 3144434657 ecr 3398301958], length 0
E..4..@.>...,...	....`...).`........7+.....
.lC.....
14:46:07.330758 IP fcb112782daa.8081 > 44.128.0.3.52576: Flags [F.], seq 110, ack 235, win 502, options [nop,nop,TS val 3398301959 ecr 3144434657], length 0
E..4BK@.@..t	...,......`.....).`....7+.....
.....lC.
14:46:07.330763 IP 44.128.0.3.52576 > fcb112782daa.8081: Flags [F.], seq 235, ack 110, win 507, options [nop,nop,TS val 3144434657 ecr 3398301958], length 0
E..4..@.>...,...	....`...).`........7+.....
.lC.....
14:46:07.330955 IP 44.128.0.3.52576 > fcb112782daa.8081: Flags [.], ack 111, win 507, options [nop,nop,TS val 3144434658 ecr 3398301959], length 0
E..4..@.>...,...	....`...).a........7+.....
.lC.....
14:46:07.330990 IP fcb112782daa.8081 > 44.128.0.3.52576: Flags [.], ack 236, win 502, options [nop,nop,TS val 3398301959 ecr 3144434657], length 0
E..4BL@.@..s	...,......`.....).a....7+.....
.....lC.
14:46:16.238442 IP 44.128.0.3.41396 > fcb112782daa.8081: Flags [S], seq 3652510309, win 64860, options [mss 1380,sackOK,TS val 1882557769 ecr 0,nop,wscale 7], length 0
E..<..@.>.}.,...	..........e.......\73.....d...
p5.I........
14:46:16.238496 IP fcb112782daa.8081 > 44.128.0.3.41396: Flags [S.], seq 136165474, ack 3652510310, win 64296, options [mss 1380,sackOK,TS val 3398310866 ecr 1882557769,nop,wscale 7], length 0
E..<..@.@...	...,..........b...f...(73.....d...
....p5.I....
14:46:16.238709 IP 44.128.0.3.41396 > fcb112782daa.8081: Flags [.], ack 1, win 507, options [nop,nop,TS val 1882557769 ecr 3398310866], length 0
E..4..@.>.}.,...	..........f...c....7+.....
p5.I....
14:46:16.239240 IP 44.128.0.3.41396 > fcb112782daa.8081: Flags [P.], seq 1:235, ack 1, win 507, options [nop,nop,TS val 1882557770 ecr 3398310866], length 234
E.....@.>.|.,...	..........f...c....8......
p5.J....GET /api/tracks/search?title=Nara&artist=alt-J HTTP/1.1
Accept: */*
User-Agent: Restler for node.js
Host: searchservice.marathon.l4lb.thisdcos.directory:8081
Accept-Encoding: gzip, deflate
Content-Length: 0
Connection: close


14:46:16.239279 IP fcb112782daa.8081 > 44.128.0.3.41396: Flags [.], ack 235, win 502, options [nop,nop,TS val 3398310867 ecr 1882557770], length 0
E..4..@.@.O.	...,..........c...P....7+.....
....p5.J
14:46:16.329035 IP fcb112782daa.8081 > 44.128.0.3.41396: Flags [P.], seq 1:108, ack 235, win 502, options [nop,nop,TS val 3398310957 ecr 1882557770], length 107
E.....@.@.N.	...,..........c...P....7......
...-p5.JHTTP/1.1 200 OK
Date: Sat, 13 Nov 2021 14:46:16 GMT
Content-type: application/json
Content-length: 2


14:46:16.329289 IP 44.128.0.3.41396 > fcb112782daa.8081: Flags [.], ack 108, win 507, options [nop,nop,TS val 1882557860 ecr 3398310957], length 0
E..4..@.>.}.,...	..........P........7+.....
p5.....-
14:46:16.329336 IP fcb112782daa.8081 > 44.128.0.3.41396: Flags [P.], seq 108:110, ack 235, win 502, options [nop,nop,TS val 3398310957 ecr 1882557860], length 2
E..6..@.@.O.	...,..............P....7-.....
...-p5..{}
14:46:16.329508 IP 44.128.0.3.41396 > fcb112782daa.8081: Flags [.], ack 110, win 507, options [nop,nop,TS val 1882557860 ecr 3398310957], length 0
E..4..@.>.}.,...	..........P........7+.....
p5.....-
14:46:16.329866 IP fcb112782daa.8081 > 44.128.0.3.41396: Flags [F.], seq 110, ack 235, win 502, options [nop,nop,TS val 3398310958 ecr 1882557860], length 0
E..4..@.@.O.	...,..............P....7+.....
....p5..
14:46:16.329930 IP 44.128.0.3.41396 > fcb112782daa.8081: Flags [F.], seq 235, ack 110, win 507, options [nop,nop,TS val 1882557861 ecr 3398310957], length 0
E..4..@.>.}.,...	..........P........7+.....
p5.....-
14:46:16.330034 IP 44.128.0.3.41396 > fcb112782daa.8081: Flags [.], ack 111, win 507, options [nop,nop,TS val 1882557861 ecr 3398310958], length 0
E..4..@.>.}.,...	..........Q........7+.....
p5......
14:46:16.330055 IP fcb112782daa.8081 > 44.128.0.3.41396: Flags [.], ack 236, win 502, options [nop,nop,TS val 3398310958 ecr 1882557861], length 0
E..4..@.@.O.	...,..............Q....7+.....
....p5..
14:46:44.278549 IP 44.128.0.3.52806 > fcb112782daa.8081: Flags [S], seq 3854841352, win 64860, options [mss 1380,sackOK,TS val 3144471605 ecr 0,nop,wscale 7], length 0
E..<..@.>.X.,...	....F....6........\73.....d...
.l.5........
14:46:44.278588 IP fcb112782daa.8081 > 44.128.0.3.52806: Flags [S.], seq 2581664249, ack 3854841353, win 64296, options [mss 1380,sackOK,TS val 3398338906 ecr 3144471605,nop,wscale 7], length 0
E..<..@.@...	...,......F......6	...(73.....d...
...Z.l.5....
14:46:44.278718 IP 44.128.0.3.52806 > fcb112782daa.8081: Flags [.], ack 1, win 507, options [nop,nop,TS val 3144471606 ecr 3398338906], length 0
E..4..@.>.X.,...	....F....6	........7+.....
.l.6...Z
14:46:44.278868 IP 44.128.0.3.52806 > fcb112782daa.8081: Flags [P.], seq 1:235, ack 1, win 507, options [nop,nop,TS val 3144471606 ecr 3398338906], length 234
E.....@.>.W.,...	....F....6	........8......
.l.6...ZGET /api/tracks/search?title=Nara&artist=alt-J HTTP/1.1
Accept: */*
User-Agent: Restler for node.js
Host: searchservice.marathon.l4lb.thisdcos.directory:8081
Accept-Encoding: gzip, deflate
Content-Length: 0
Connection: close


14:46:44.278893 IP fcb112782daa.8081 > 44.128.0.3.52806: Flags [.], ack 235, win 502, options [nop,nop,TS val 3398338907 ecr 3144471606], length 0
E..4.U@.@..j	...,......F......6.....7+.....
...[.l.6
14:46:44.290110 IP fcb112782daa.8081 > 44.128.0.3.52806: Flags [P.], seq 1:108, ack 235, win 502, options [nop,nop,TS val 3398338918 ecr 3144471606], length 107
E....V@.@...	...,......F......6.....7......
...f.l.6HTTP/1.1 200 OK
Date: Sat, 13 Nov 2021 14:46:44 GMT
Content-type: application/json
Content-length: 2


14:46:44.290229 IP 44.128.0.3.52806 > fcb112782daa.8081: Flags [.], ack 108, win 507, options [nop,nop,TS val 3144471617 ecr 3398338918], length 0
E..4..@.>.X.,...	....F....6....e....7+.....
.l.A...f
14:46:44.290252 IP fcb112782daa.8081 > 44.128.0.3.52806: Flags [P.], seq 108:110, ack 235, win 502, options [nop,nop,TS val 3398338918 ecr 3144471617], length 2
E..6.W@.@..f	...,......F...e..6.....7-.....
...f.l.A{}
14:46:44.290327 IP 44.128.0.3.52806 > fcb112782daa.8081: Flags [.], ack 110, win 507, options [nop,nop,TS val 3144471617 ecr 3398338918], length 0
E..4..@.>.X.,...	....F....6....g....7+.....
.l.A...f
14:46:44.290511 IP 44.128.0.3.52806 > fcb112782daa.8081: Flags [F.], seq 235, ack 110, win 507, options [nop,nop,TS val 3144471617 ecr 3398338918], length 0
E..4..@.>.X.,...	....F....6....g....7+.....
.l.A...f
14:46:44.327959 IP fcb112782daa.8081 > 44.128.0.3.52806: Flags [F.], seq 110, ack 236, win 502, options [nop,nop,TS val 3398338956 ecr 3144471617], length 0
E..4.X@.@..g	...,......F...g..6.....7+.....
.....l.A
14:46:44.328178 IP 44.128.0.3.52806 > fcb112782daa.8081: Flags [.], ack 111, win 507, options [nop,nop,TS val 3144471655 ecr 3398338956], length 0
E..4.	@.>.X.,...	....F....6....h....7+.....
.l.g....
14:46:55.292017 IP 44.128.0.3.41640 > fcb112782daa.8081: Flags [S], seq 1485199704, win 64860, options [mss 1380,sackOK,TS val 1882596823 ecr 0,nop,wscale 7], length 0
E..<.V@.>.wa,...	.......X.YX.......\73.....d...
p6%.........
14:46:55.292044 IP fcb112782daa.8081 > 44.128.0.3.41640: Flags [S.], seq 4020124570, ack 1485199705, win 64296, options [mss 1380,sackOK,TS val 3398349920 ecr 1882596823,nop,wscale 7], length 0
E..<..@.@...	...,.........;.X.YY...(73.....d...
...`p6%.....
14:46:55.292143 IP 44.128.0.3.41640 > fcb112782daa.8081: Flags [.], ack 1, win 507, options [nop,nop,TS val 1882596823 ecr 3398349920], length 0
E..4.W@.>.wh,...	.......X.YY..;.....7+.....
p6%....`
14:46:55.292260 IP 44.128.0.3.41640 > fcb112782daa.8081: Flags [P.], seq 1:235, ack 1, win 507, options [nop,nop,TS val 1882596823 ecr 3398349920], length 234
E....X@.>.v},...	.......X.YY..;.....8......
p6%....`GET /api/tracks/search?title=Nara&artist=alt-J HTTP/1.1
Accept: */*
User-Agent: Restler for node.js
Host: searchservice.marathon.l4lb.thisdcos.directory:8081
Accept-Encoding: gzip, deflate
Content-Length: 0
Connection: close


14:46:55.292278 IP fcb112782daa.8081 > 44.128.0.3.41640: Flags [.], ack 235, win 502, options [nop,nop,TS val 3398349920 ecr 1882596823], length 0
E..4.S@.@..l	...,.........;.X.ZC....7+.....
...`p6%.
14:46:55.328034 IP fcb112782daa.8081 > 44.128.0.3.41640: Flags [P.], seq 1:108, ack 235, win 502, options [nop,nop,TS val 3398349956 ecr 1882596823], length 107
E....T@.@...	...,.........;.X.ZC....7......
....p6%.HTTP/1.1 200 OK
Date: Sat, 13 Nov 2021 14:46:55 GMT
Content-type: application/json
Content-length: 2


14:46:55.328217 IP 44.128.0.3.41640 > fcb112782daa.8081: Flags [.], ack 108, win 507, options [nop,nop,TS val 1882596859 ecr 3398349956], length 0
E..4.Y@.>.wf,...	.......X.ZC..<.....7+.....
p6%.....
14:46:55.328297 IP fcb112782daa.8081 > 44.128.0.3.41640: Flags [P.], seq 108:110, ack 235, win 502, options [nop,nop,TS val 3398349956 ecr 1882596859], length 2
E..6.U@.@..h	...,.........<.X.ZC....7-.....
....p6%.{}
14:46:55.328388 IP 44.128.0.3.41640 > fcb112782daa.8081: Flags [.], ack 110, win 507, options [nop,nop,TS val 1882596859 ecr 3398349956], length 0
E..4.Z@.>.we,...	.......X.ZC..<.....7+.....
p6%.....
14:46:55.328665 IP 44.128.0.3.41640 > fcb112782daa.8081: Flags [F.], seq 235, ack 110, win 507, options [nop,nop,TS val 1882596859 ecr 3398349956], length 0
E..4.[@.>.wd,...	.......X.ZC..<.....7+.....
p6%.....
14:46:55.328911 IP fcb112782daa.8081 > 44.128.0.3.41640: Flags [F.], seq 110, ack 236, win 502, options [nop,nop,TS val 3398349957 ecr 1882596859], length 0
E..4.V@.@..i	...,.........<.X.ZD....7+.....
....p6%.
14:46:55.329033 IP 44.128.0.3.41640 > fcb112782daa.8081: Flags [.], ack 111, win 507, options [nop,nop,TS val 1882596860 ecr 3398349957], length 0
E..4.\@.>.wc,...	.......X.ZD..<	....7+.....
p6%.....
14:47:10.703046 IP 44.128.0.3.52986 > fcb112782daa.8081: Flags [S], seq 794905525, win 64860, options [mss 1380,sackOK,TS val 3144498030 ecr 0,nop,wscale 7], length 0
E..<..@.>.^.,...	......./aK........\73.....d...
.m;n........
14:47:10.703095 IP fcb112782daa.8081 > 44.128.0.3.52986: Flags [S.], seq 2460088848, ack 794905526, win 64296, options [mss 1380,sackOK,TS val 3398365331 ecr 3144498030,nop,wscale 7], length 0
E..<..@.@...	...,.........../aK....(73.....d...
.....m;n....
14:47:10.703313 IP 44.128.0.3.52986 > fcb112782daa.8081: Flags [.], ack 1, win 507, options [nop,nop,TS val 3144498030 ecr 3398365331], length 0
E..4..@.>.^5,...	......./aK.........7+.....
.m;n....
14:47:10.703573 IP 44.128.0.3.52986 > fcb112782daa.8081: Flags [P.], seq 1:235, ack 1, win 507, options [nop,nop,TS val 3144498030 ecr 3398365331], length 234
E.....@.>.]J,...	......./aK.........8......
.m;n....GET /api/tracks/search?title=Nara&artist=alt-J HTTP/1.1
Accept: */*
User-Agent: Restler for node.js
Host: searchservice.marathon.l4lb.thisdcos.directory:8081
Accept-Encoding: gzip, deflate
Content-Length: 0
Connection: close


14:47:10.703607 IP fcb112782daa.8081 > 44.128.0.3.52986: Flags [.], ack 235, win 502, options [nop,nop,TS val 3398365331 ecr 3144498030], length 0
E..4..@.@.,.	...,.........../aL.....7+.....
.....m;n
14:47:10.713861 IP fcb112782daa.8081 > 44.128.0.3.52986: Flags [P.], seq 1:108, ack 235, win 502, options [nop,nop,TS val 3398365342 ecr 3144498030], length 107
E.....@.@.,.	...,.........../aL.....7......
.....m;nHTTP/1.1 200 OK
Date: Sat, 13 Nov 2021 14:47:10 GMT
Content-type: application/json
Content-length: 2


14:47:10.713946 IP 44.128.0.3.52986 > fcb112782daa.8081: Flags [.], ack 108, win 507, options [nop,nop,TS val 3144498041 ecr 3398365342], length 0
E..4..@.>.^3,...	......./aL....|....7+.....
.m;y....
14:47:10.713962 IP fcb112782daa.8081 > 44.128.0.3.52986: Flags [P.], seq 108:110, ack 235, win 502, options [nop,nop,TS val 3398365342 ecr 3144498041], length 2
E..6..@.@.,.	...,..........|/aL.....7-.....
.....m;y{}
14:47:10.714026 IP 44.128.0.3.52986 > fcb112782daa.8081: Flags [.], ack 110, win 507, options [nop,nop,TS val 3144498041 ecr 3398365342], length 0
E..4..@.>.^2,...	......./aL....~....7+.....
.m;y....
14:47:10.714200 IP fcb112782daa.8081 > 44.128.0.3.52986: Flags [F.], seq 110, ack 235, win 502, options [nop,nop,TS val 3398365342 ecr 3144498041], length 0
E..4..@.@.,.	...,..........~/aL.....7+.....
.....m;y
14:47:10.714220 IP 44.128.0.3.52986 > fcb112782daa.8081: Flags [F.], seq 235, ack 110, win 507, options [nop,nop,TS val 3144498041 ecr 3398365342], length 0
E..4..@.>.^1,...	......./aL....~....7+.....
.m;y....
14:47:10.714300 IP 44.128.0.3.52986 > fcb112782daa.8081: Flags [.], ack 111, win 507, options [nop,nop,TS val 3144498041 ecr 3398365342], length 0
E..4..@.>.^0,...	......./aL.........7+.....
.m;y....
14:47:10.714319 IP fcb112782daa.8081 > 44.128.0.3.52986: Flags [.], ack 236, win 502, options [nop,nop,TS val 3398365342 ecr 3144498041], length 0
E..4..@.@.,.	...,.........../aL.....7+.....
.....m;y
14:47:18.389433 IP 44.128.0.3.41794 > fcb112782daa.8081: Flags [S], seq 2912439661, win 64860, options [mss 1380,sackOK,TS val 1882619920 ecr 0,nop,wscale 7], length 0
E..<..@.>.d.,...	....B....Mm.......\73.....d...
p6..........
14:47:18.389478 IP fcb112782daa.8081 > 44.128.0.3.41794: Flags [S.], seq 3949835894, ack 2912439662, win 64296, options [mss 1380,sackOK,TS val 3398373017 ecr 1882619920,nop,wscale 7], length 0
E..<..@.@...	...,......B.m.v..Mn...(73.....d...
....p6......
14:47:18.389673 IP 44.128.0.3.41794 > fcb112782daa.8081: Flags [.], ack 1, win 507, options [nop,nop,TS val 1882619920 ecr 3398373017], length 0
E..4..@.>.d.,...	....B....Mn.m.w....7+.....
p6......
14:47:18.389901 IP 44.128.0.3.41794 > fcb112782daa.8081: Flags [P.], seq 1:235, ack 1, win 507, options [nop,nop,TS val 1882619921 ecr 3398373017], length 234
E.....@.>.c.,...	....B....Mn.m.w....8......
p6......GET /api/tracks/search?title=Nara&artist=alt-J HTTP/1.1
Accept: */*
User-Agent: Restler for node.js
Host: searchservice.marathon.l4lb.thisdcos.directory:8081
Accept-Encoding: gzip, deflate
Content-Length: 0
Connection: close


14:47:18.389928 IP fcb112782daa.8081 > 44.128.0.3.41794: Flags [.], ack 235, win 502, options [nop,nop,TS val 3398373018 ecr 1882619921], length 0
E..4.h@.@.}W	...,......B.m.w..NX....7+.....
....p6..
14:47:18.435914 IP fcb112782daa.8081 > 44.128.0.3.41794: Flags [P.], seq 1:108, ack 235, win 502, options [nop,nop,TS val 3398373064 ecr 1882619921], length 107
E....i@.@.|.	...,......B.m.w..NX....7......
....p6..HTTP/1.1 200 OK
Date: Sat, 13 Nov 2021 14:47:18 GMT
Content-type: application/json
Content-length: 2


14:47:18.436243 IP 44.128.0.3.41794 > fcb112782daa.8081: Flags [.], ack 108, win 507, options [nop,nop,TS val 1882619967 ecr 3398373064], length 0
E..4..@.>.d.,...	....B....NX.m......7+.....
p6.?....
14:47:18.436295 IP fcb112782daa.8081 > 44.128.0.3.41794: Flags [P.], seq 108:110, ack 235, win 502, options [nop,nop,TS val 3398373064 ecr 1882619967], length 2
E..6.j@.@.}S	...,......B.m....NX....7-.....
....p6.?{}
14:47:18.436492 IP 44.128.0.3.41794 > fcb112782daa.8081: Flags [.], ack 110, win 507, options [nop,nop,TS val 1882619967 ecr 3398373064], length 0
E..4..@.>.d.,...	....B....NX.m......7+.....
p6.?....
14:47:18.436899 IP fcb112782daa.8081 > 44.128.0.3.41794: Flags [F.], seq 110, ack 235, win 502, options [nop,nop,TS val 3398373065 ecr 1882619967], length 0
E..4.k@.@.}T	...,......B.m....NX....7+.....
....p6.?
14:47:18.436898 IP 44.128.0.3.41794 > fcb112782daa.8081: Flags [F.], seq 235, ack 110, win 507, options [nop,nop,TS val 1882619968 ecr 3398373064], length 0
E..4..@.>.d.,...	....B....NX.m......7+.....
p6.@....
14:47:18.437149 IP 44.128.0.3.41794 > fcb112782daa.8081: Flags [.], ack 111, win 507, options [nop,nop,TS val 1882619968 ecr 3398373065], length 0
E..4..@.>.d.,...	....B....NY.m......7+.....
p6.@....
14:47:18.437173 IP fcb112782daa.8081 > 44.128.0.3.41794: Flags [.], ack 236, win 502, options [nop,nop,TS val 3398373065 ecr 1882619968], length 0
E..4.l@.@.}S	...,......B.m....NY....7+.....
....p6.@
14:47:42.687306 IP 44.128.0.3.53464 > fcb112782daa.8081: Flags [S], seq 3865887545, win 64860, options [mss 1380,sackOK,TS val 3144530014 ecr 0,nop,wscale 7], length 0
E..<=.@.>...,...	........l.9.......\73.....d...
.m.^........
14:47:42.687359 IP fcb112782daa.8081 > 44.128.0.3.53464: Flags [S.], seq 2046746692, ack 3865887546, win 64296, options [mss 1380,sackOK,TS val 3398397315 ecr 3144530014,nop,wscale 7], length 0
E..<..@.@...	...,.......y..D.l.:...(73.....d...
..m..m.^....
14:47:42.687576 IP 44.128.0.3.53464 > fcb112782daa.8081: Flags [.], ack 1, win 507, options [nop,nop,TS val 3144530014 ecr 3398397315], length 0
E..4=.@.>...,...	........l.:y..E....7+.....
.m.^..m.
14:47:42.687856 IP 44.128.0.3.53464 > fcb112782daa.8081: Flags [P.], seq 1:269, ack 1, win 507, options [nop,nop,TS val 3144530015 ecr 3398397315], length 268
E..@=.@.>...,...	........l.:y..E....87.....
.m._..m.GET /api/tracks/search?title=%22Kal%20Ho%20Naa%20Ho%22&artist=%22sonu%20nigam%22 HTTP/1.1
Accept: */*
User-Agent: Restler for node.js
Host: searchservice.marathon.l4lb.thisdcos.directory:8081
Accept-Encoding: gzip, deflate
Content-Length: 0
Connection: close


14:47:42.687882 IP fcb112782daa.8081 > 44.128.0.3.53464: Flags [.], ack 269, win 502, options [nop,nop,TS val 3398397316 ecr 3144530015], length 0
E..4.k@.@.-T	...,.......y..E.l.F....7+.....
..m..m._
14:47:42.692243 IP fcb112782daa.37288 > 25.443: Flags [P.], seq 716255555:716255586, ack 2364317216, win 502, options [nop,nop,TS val 3319494771 ecr 17854497], length 31
E..S.G@.@.5.	...#.......*.1C... ...........
..xs..p!.............>....Vp.n.q2:y...?
14:47:42.692325 IP fcb112782daa.37288 > 25.443: Flags [F.], seq 31, ack 1, win 502, options [nop,nop,TS val 3319494771 ecr 17854497], length 0
E..4.H@.@.5&	...#.......*.1b... .....|.....
..xs..p!
14:47:42.692689 IP fcb112782daa.37676 > 198.51.100.1.53: 39260+ PTR? 25.224.186.35.in-addr.arpa. (44)
E..Huq@.@..}	....3d..,.5.44..\...........25.224.186.35.in-addr.arpa.....
14:47:42.704018 IP 198.51.100.1.53 > fcb112782daa.37676: 39260 1/0/0 PTR 25.224.186.35.bc.googleusercontent.com. (96)
E..|$.@.@....3d.	....5.,.h50.\...........25.224.186.35.in-addr.arpa..............P.(.25.224.186.35.bc.googleusercontent.com.
14:47:42.715695 IP fcb112782daa.37288 > 25.443: Flags [F.], seq 31, ack 1, win 502, options [nop,nop,TS val 3319494795 ecr 17854497], length 0
E..4.I@.@.5%	...#.......*.1b... .....|.....
..x...p!
14:47:42.782489 IP fcb112782daa.35968 > 198.51.100.1.53: 50688+ A? api.spotify.com. (33)
E..=u.@.@..y	....3d....5.)4..............api.spotify.com.....
14:47:42.799848 IP 198.51.100.1.53 > fcb112782daa.35968: 50688 2/0/0 CNAME edge-web.dual-gslb.spotify.com., A 35.186.224.25 (82)
E..n$.@.@....3d.	....5...Z5".............api.spotify.com..................edge-web	dual-gslb...-..........#...
14:47:42.800412 IP fcb112782daa.47082 > 25.443: Flags [S], seq 2938589209, win 64860, options [mss 1380,sackOK,TS val 3319494879 ecr 0,nop,wscale 7], length 0
E..<..@.@.c.	...#........'P........\.......d...
..x.........
14:47:42.801048 IP 25.443 > fcb112782daa.47082: Flags [S.], seq 571918495, ack 2938589210, win 14480, options [mss 1460,sackOK,TS val 17959630 ecr 3319494879,nop,wscale 7], length 0
E..<.
@.4.j\#...	......."....'P...8............
..
...x.....
14:47:42.801089 IP fcb112782daa.47082 > 25.443: Flags [.], ack 1, win 507, options [nop,nop,TS val 3319494880 ecr 17959630], length 0
E..4..@.@.c.	...#........'P."........|.....
..x...
.
14:47:42.802299 IP fcb112782daa.47082 > 25.443: Flags [P.], seq 1:275, ack 1, win 507, options [nop,nop,TS val 3319494881 ecr 17959630], length 274
E..F..@.@.b.	...#........'P."..............
..x...
.........	..a...m>..`.OW...I.W[..g.....}
.q. x./-mSwo..t~(...!..g....8"ox./.
.d.$.(.=.&.*.k.j.
...5.....9.8.#.'.<.%.).g.@.	.../.....3.2.,.+.0.....2...../...-.1.........
.............\.
...........	.
.............................................................api.spotify.com
14:47:42.802824 IP 25.443 > fcb112782daa.47082: Flags [.], ack 275, win 122, options [nop,nop,TS val 17959630 ecr 3319494881], length 0
E..4.n@.4.v.#...	......."....'Q,...zx......
..
...x.
14:47:42.852005 IP 25.443 > fcb112782daa.47082: Flags [P.], seq 1:148, ack 275, win 122, options [nop,nop,TS val 17959635 ecr 3319494881], length 147
E....o@.4.ul#...	......."....'Q,...zB......
..
...x.....[...W..a...W3......_.Z..]...y..DOWNGRD. x./-mSwo..t~(...!..g....8"ox./.
./............................(........0^g\.A../o......G..t...g..4	fwU|
14:47:42.852033 IP fcb112782daa.47082 > 25.443: Flags [.], ack 148, win 506, options [nop,nop,TS val 3319494931 ecr 17959635], length 0
E..4..@.@.c.	...#........'Q,"..3.....|.....
..y...
.
14:47:42.852717 IP fcb112782daa.47082 > 25.443: Flags [P.], seq 275:281, ack 148, win 506, options [nop,nop,TS val 3319494932 ecr 17959635], length 6
E..:..@.@.c.	...#........'Q,"..3...........
..y...
.......
14:47:42.852963 IP fcb112782daa.47082 > 25.443: Flags [P.], seq 281:326, ack 148, win 506, options [nop,nop,TS val 3319494932 ecr 17959635], length 45
E..a..@.@.c.	...#........'Q2"..3...........
..y...
.....(........k.a..9Iz..O.~..
.;..`pdzt..ce...
14:47:42.853157 IP 25.443 > fcb112782daa.47082: Flags [.], ack 281, win 122, options [nop,nop,TS val 17959635 ecr 3319494932], length 0
E..4.p@.4.u.#...	......."..3.'Q2...zw......
..
...y.
14:47:42.853291 IP fcb112782daa.47082 > 25.443: Flags [P.], seq 326:709, ack 148, win 506, options [nop,nop,TS val 3319494932 ecr 17959635], length 383
E.....@.@.bY	...#........'Q_"..3...........
..y...
.....z........$.....0W.._.W..,4.r.e....
Ns!m@....a=].(.....}Q[..:.I<..!.d:...	...X.}...<.Q...~..A.9....E+........w..S.q........z.O......O...
.4..b.OpW.Jg...^..........GU^(....G.>9=..hU..R.....t..P.7q.[rU.d...M..+...@.F...W...z..~P......;............^....:.X.............,g......|0.z......l..Q....
...).k.V...1.v.....`e.B.)Tg_.tg.R..)....u.%:..S.\U-....U...o......I.g.A8a'o}..}1..c+...
14:47:42.853366 IP 25.443 > fcb112782daa.47082: Flags [.], ack 326, win 122, options [nop,nop,TS val 17959635 ecr 3319494932], length 0
E..4.q@.4.u.#...	......."..3.'Q_...zw......
..
...y.
14:47:42.853701 IP 25.443 > fcb112782daa.47082: Flags [.], ack 709, win 130, options [nop,nop,TS val 17959635 ecr 3319494932], length 0
E..4.r@.4.u.#...	......."..3.'R.....v......
..
...y.
14:47:42.927697 IP fcb112782daa.37288 > 25.443: Flags [FP.], seq 0:31, ack 1, win 502, options [nop,nop,TS val 3319495007 ecr 17854497], length 31
E..S.J@.@.5.	...#.......*.1C... ...........
..y_..p!.............>....Vp.n.q2:y...?
14:47:42.963855 IP 25.443 > fcb112782daa.47082: Flags [P.], seq 148:1566, ack 709, win 130, options [nop,nop,TS val 17959646 ecr 3319494932], length 1418
E....s@.4.pq#...	......."..3.'R............
..
...y..............\./..{....r.......5...D.w..=l......v.s.pv.K.=^.."..g}.]..P.
..x...E.....,..O11..+...H.. ...R....2J.JM...P..v....u.,2.....O...3.8...x.....WI^..qdxu.....	{...o....... ..".......Zqe.......}.&.S...^I@.@<..U...$d-..t.K.k..u>.x..V.......6..1.;4..fN...Z.me[0.....D..~.....Sc..r..}...L...b[..,ND#ym:.....Z.......c."1.`9_]Q.n.F..S..`/.........~N.6...3.e...z.).`.a.s....*,}.Z.WN..+G...>.
.]:.R.@......%....1t.......y.Z.L...X..\..K"....	......sA.Qv<#....Iz=...V.]...F.]...d4N.t..+....0.:1{...0O8....iR.wKY......6.V..&v..........:.......w.-.Q......h.<.I..u.....S}wK.z.i....8g.Q%J.....6@du......;..&..l..{.....2.)qf.\8....9./...~.(....&x.<...B.an..&p.......L:.v....../.tT..*w..r....+..=.).X...($Z..+..ZS.\...+.p\.v.R..X...`.@ln....[.............:.7..&\.....\......(_}.&......#.I*...z...U...<t9.....-..w.;.,...m...2..*i..2z..Bu?..42IS..*7...,..\..a.:...E..E....6.J*j@x.........#{......o..4.:SfjZ.d.d".._..;".........l5u.4/.mV....u....{..>. .3.....O.e.n.@...'ot.....+%......OFn.0p...9D..'S1w.*5..r`..|.Q._...:.Z.u2$.......K.{m.1{...V.<.X....s..W..Q......H.[*.0.(.P..|.HA6..n.....N.2..|..............5&.......c.._]...{YK'TxB.....=..U.IB....O...`.?d..u7A.2wX,..~x.]...%N.v._.;~.....+..$.g.!.....x.3..
Yl.P...K.5gC...-Z.'"V&..}..r....T9FG.{C.8.._..2.u.oj..G.k:.L..F.@{.z.w1..0..'..N.~....|P..s.]H8.`....0g...Y.C.....dK.M.m.ns.A...C7....^w.}.Dw6...._.-...t-...c...s....a......P=....M.......#/.....i.Pri...M'@.p.&.^.....lf...
14:47:42.963899 IP fcb112782daa.47082 > 25.443: Flags [.], ack 1566, win 501, options [nop,nop,TS val 3319495043 ecr 17959646], length 0
E..4..@.@.c.	...#........'R."........|.....
..y...
.
14:47:42.963863 IP 25.443 > fcb112782daa.47082: Flags [P.], seq 1566:4402, ack 709, win 130, options [nop,nop,TS val 17959646 ecr 3319494932], length 2836
E..H.u@.4.j.#...	......."....'R............
..
...y.................rD.*....{......,...h...&6..d.g..H.;h.7+,.V.{/.grr........t..;.#.`.1.q.(>.'..../..gk........].t*...W...F>.!.....A6....4.L..JYH.D..D._.$>.wr......3/.S<.....%.....C...O...L..[...u:i-P...H5..].v	b7J...n.......4,k.V.w.........I...s.#:}..@P..J.t...~.5.&
...a..:z,.av/5K.........T.<O.q.(..>..i9......L27..R.)+....8...RkS.Y...13.]....*..O.....	..).. .kP.u(:#u-..e.........hv.....i	..G<[H.....P..[.\h.I..".Q...hW0jj.9LM.{...:...o-..../...B=W....oN.+..%A8....KPt\.lc)...n..B..D.3...[$.........&.W.O.nF^......mz.<...{S.A{`'.D.W......Z.....8]^.b..jrT..=....W.......%.e...?.(..;Z%>ksp.!.....&^..`.3/.j..i ..<........._..G....X[.".E..($..1{....DKh..............(?...6.vdd....p.V(V.(# k......
n}_.w`..1~,/u....%*-U....f.0..r,4.<...E..^br....A..T..._#Z.....&
.!....b.U[we....@.@.B7..h.n.....'.NJ=V......]SV@.0\...7U*..KIO....c.....U.....\..@..	0.%.[..!K>z.1.a).=JZU.$.l.I..>...p.]{.....jS..zu.. ..H.{.q'....q']..Y.Kq..t...b..N.9.$.^dy.z...!&@..f.m.....v...>............6/.....v.b..W....!~.....Q'D0Kv.\ ..p..$[.L.z.B.P..).K.........q..I.......v......N;.yJ.ak;.....F{....e.b[.F..}.Bt.....T8',..`.3.KE....!..x.................1.2.%.#).....g..o..&.l|....u/+....Uz+.....{..L`.8.$-r.>
.O.o	.....?...$a.......;>;u.D.;. ......gR..y...a..z.........Xy.....O.........i.....>. .4.Oy..:.W.......AV.}S..........O ...(.`..p...Et.<.K.(1.2G..u.J..."...KI..F..8.....t....O..$.........M....}.	.....r..X/.\..	8B......M01....qO.7Y..._s]..;..............D..<...W,".s....H.b...L..."....L..........g.(._.l.,..m.l.[r.z.<.L'G1...g.1%?l..B... ....J.Q?.7/...\...rZ.2...}	.~..,.....=.......+.x]...:...P.....M2.............5.t-. ].?R.E.9...SH...H.[.JY...y..^i.Ep...=*.ya?...U.... .i.^e(....}.;f..$.....88.ge..n.....F..(..gm.5#p...F.X^.`.t........	.I{;6p......0...0I\,S3.zh.f...r.2lLDW.V..c......[..'h.@VG
..=k...r..*...N.`P..k.M.%RF..y...Q..-.8.O.*.........F.j.z.Fx..j.....V........g......K..a........."....Da...x.......D.......OW.aaQe.-.......[.N9.(6^..v.....I....K.\..'.M.....p0H.PQa.y..8A....),...<7v.........5`...D..K\...s.{..?.QL..........3.8...$....5:...E.M.r.n...
.r..0.j.}.S...*.[.^.\.....\..9s.'.Y..{.M..._l..3x=+.S......W(X;.........=.:..8....{.A1.s...*L R..J......T..`.[.Qy..;8bAl.`.....^..F*g.....
Ir.3...O..*..}.g.F[T'{m.....N_.....$..[...g..f.|..-r..`U..bDH...'..`~.23._.e`?..`t#||.u....!.f.`.H...@.....d..0B..E`..b.!k.~]...\.~
....:=.hP.c...g.v......W.(".Q.%...N}..+uM0.2RE\..R."..Z.......)....a.N.m4s...........5..Y|l.y.c.....v...#X.V/.....l..q....`8.	y..q..I.f....V..qK.......]...-...J...Pr....#Q.{.....q..{}...8.?Kk.r.KO..6..........._.y2.!5.c...iv...E..q.c)....q....O}B}..}.H.7..m.LB.....<-.w"..M..l~..;6...E.......l*9...._0"..m.....:R8...#.Kw...{..~:.?XR...m.c.w..W........-.9\.p%=a.1...f........5...|g..g...m..KsU..Y>...
~...G.....,.........x[  ;,gfG...i..`.v~+l.O....gZ............5._..r..v... [.k..z#....d......bc./.YNI}cH..2/"..j.Y%X.8.......
14:47:42.963917 IP fcb112782daa.47082 > 25.443: Flags [.], ack 4402, win 480, options [nop,nop,TS val 3319495043 ecr 17959646], length 0
E..4..@.@.c.	...#........'R."........|.....
..y...
.
14:47:42.964002 IP 25.443 > fcb112782daa.47082: Flags [P.], seq 4402:5820, ack 709, win 130, options [nop,nop,TS val 17959646 ecr 3319494932], length 1418
E....x@.4.pl#...	......."....'R............
..
...y..............H...~..KN.R....h.$O..Uz..j.DC8U.$..N.%v.<6..Ve.|.z.#.} .B....c.I[.b....$Y....eo...B.<..3.L.E.e.d.=.i..."........r.k~.e>...........^....^ 7(..M...[;.oV...a....:@:t\..6.D.J......$.{.k...!...(Q.q*`c..=/...glc......n.~..::)..bJ.0..\?...R.T.o9.X..(v.^8.b.S...mr.x.j7..>....F.X.-.......G.|+.e....6U.<..A.1..=...t.r`.,. ..22!.._.....>.....d....%.f8..Y<fH....c...K..4.$..z..t`3...~?N!.0.VE..g.g^R....I....km.......M.@.F...na....$.CF$... {.t...t........2.I....0K..-#.6|fp..<..h|..=W.m...K_9...]V...........;QO...P.N..........E'@..V.........&-....e...5..O}...w5.V...^.........9N...W.......$.."Y*o......y-.:mz..tn...J.b..Q..f.....{JywE/.?.......yh".N...p.YvHd.f..7..7m..@...\.z.E|s..Ep...C./.=*....b....3...........=...|.,..<...IFK.......x.]z......c.......0..x..1.h...\.s.............}\..T.D)&..j.n#........W-.)4~'......#..L.@.....u..g....6j.....a[..q.O.....h..q|;4=B....b.f.y...xg..M...,...p.5.4Q..9.|.{.l...f...{\.j....mF....@w~..d.~1W..Aj.%...R..:.....l]K.c..(....Z..&.J.............J7.'.[X........6.....!Hl...2"(...
.......Zh.$`r...x.../6.2.PIiVc....S.1...PO,.........../Q.}8.6...#......Z..)..3!......x%.5C....5..0..I....a:....R]=.?0M[yoa\.w.!)8..R.s..Mu...J.%. .e..!..^.z........z..C..f.:!.B:............p...7.*... .D]=.]].....'.....[.x..M...*.|.<. +..?..*......1..s...x..y.....D....._.....h.../5~q..7..{m..0.....`.....(!Z.m..,...s.w6i.:~.n..~.D........9...c._o1..?....5..0.....C%.El..5......K.E..0bw#)...n.....
14:47:42.964026 IP fcb112782daa.47082 > 25.443: Flags [.], ack 5820, win 480, options [nop,nop,TS val 3319495043 ecr 17959646], length 0
E..4..@.@.c.	...#........'R."..[.....|.....
..y...
.
14:47:42.964008 IP 25.443 > fcb112782daa.47082: Flags [P.], seq 5820:7238, ack 709, win 130, options [nop,nop,TS val 17959646 ecr 3319494932], length 1418
E....z@.4.pj#...	......."..[.'R............
..
...y.1.......Lf.D...a.....{.vj."i?t%v@0.cd*.b.'..I.+.L(+...>...a......w..y.K-...JV.Y....~S.Xt.a_....Md..S.a.q.................>.@...RyOQ...wMvd0.......V.'...s..<:7$l}#.......]6Q.J.M!...Y
.4.....<l..T* L..G..Cl....>'!...&.
Y.+...Ha;.......$....n..{....Y.#.....].(7...mq..Nu..E..Q.....("yC.S...	+1d.........8gYyYS..@..I...Z..Aq...N...8.......fT...}qY./;..=~j{@F....f
;...."..?....G......p.N..`...'.eK.......}..e-}.$.)..q..*.}..TQ#F..B..........!.7..J....JO........X=V.).J......m
~e....\>....*V..
......Rs..S..6w....)..l*......V.=..s...\...:..r*...Q_..'../..(e.R.0}p0._.#	..'..O.....F~)H..rZ.........Q&Y.hG.....~.p.}K)....F'...z..X....g?.C.=+V...b.M..E.g.3...xAX..i.$..!G....C..d..KS0*..S8.)N........t.H....g.V...j..+..%..H.0...#T......xjqN....Ht.h.4zM.......;z.\(.GA.....u.&W.C..*..............?......\..T...v.....c*....c...........#..kJ........"q#.PX%.fo..(...........*u.......%......(N..5..g1Lr..H..(..D.U.W".N...;...|..+....v....v.G}..6.!`....~(.[T.W.[.../...."..!.5l|..n.?I....5
%r.4T.9"........+5O.......g.....PE..E...._.pyA.?..>dU...|....C@{........~..Z.v.OC.....|.....M,..m.j...0....x.......!..K......l3.D3............+..o..'..n..u.......qz..B8.......E.r.{..t9H56...S[X.c..M.e.......l%u.....5z...5..%.....1......3[....,...i.j..M.$01.x7..2.(..<.....\.....j..s....@.s;...6.6. .....*Zj..H..'.G.H-........:.a.c6J.....;VB..4.. .|2.E.....@g.H.6....V....3g)..P....UO.)....q5.........#.j..G..ssQl.,...*...SJ....CycYk.:.AKU.*..
14:47:42.964032 IP fcb112782daa.47082 > 25.443: Flags [.], ack 7238, win 469, options [nop,nop,TS val 3319495043 ecr 17959646], length 0
E..4..@.@.c.	...#........'R."........|.....
..y...
.
14:47:42.964018 IP 25.443 > fcb112782daa.47082: Flags [.], seq 7238:8606, ack 709, win 130, options [nop,nop,TS val 17959646 ecr 3319494932], length 1368
E....|@.4.p.#...	......."....'R............
..
...y.N.UK..m..........V6B.Mf..'C..z.G......._.._.he$..3V...r..UT&...a..0."h...y.Wk.<1	.dg.Z.s.|...w .......v.2."./,t{J..Q2+.qS_c........=..	...`p..J...H.+*VZ...c<....!...X..hG3N......dO.(..$.X..p.@B".b..PJ.....;Sg......?.......AP....;.E...'V............?.. 3.w...p|.s}X.} .T/B..
g.L..l?.......*je	.......j.o..D3..2... |.o.w...5ky.x.&D.#Y.....&.D.....]....A.
=.F?..].(..mcr...=.._B..cQ.RTK#....(.Q>.G...22.\r...........+...N....A...Zd..)....
...ZS..4l.n.$...*...#:.B.hKC.....Ni..M;........Lm..7c3C......P-0:..~y..tJIw=U.c..].....y....{
..a.	w..N*..m.cS.>.b.{.5".O...'..{}.m.."x#fk...DR.......,......m......."..|.m..=>].......u.S.]	.Y.76..M.$.^..W#..[x.V..
`.g..	..lk.$_Lt....+.Q...d ..3...A........4n..bE....9..k3.MI.K.y.....@P..F..u>Tn......#.....3Db."<.3..x..^.0.y..D......4X................<UXG.g?.....K.....L.G....Z(....s6;3.XO9...'..3...-..........y!.v`...n...Iq....#.....EXf.....)
....vp.'..i..y\....5..0.NB.<[$p,..Q..w..........%w...5.cA....4...Hb|..[...?.@f..4...?..........J......w..-..[4*k.NCN...'4.Z....{. .p@v!.....dKB.....=...Z.G....o........M%C*.zg.\... ...2..%.p+..!..9.;.!SC.v.6.s.u5...n..\..(....T.r.A.u...qT..J.sN...X....<OG...o........G....:.hV..._5.IR...a.....:x{...#.~.#.._....7.....<.........-..L+(..X..i.!6...F.A@.#....I#F..>.....W..D.....T.....s.}3........T>H.u.s.z.p.X.=......*=w..@3.qy..u...........{..dv...v.t....,}MA...`.6...?9.....OsY.h..)B.O...
14:47:42.964039 IP fcb112782daa.47082 > 25.443: Flags [.], ack 8606, win 460, options [nop,nop,TS val 3319495043 ecr 17959646], length 0
E..4..@.@.c.	...#........'R."..=.....|.....
..y...
.
14:47:42.964266 IP 25.443 > fcb112782daa.47082: Flags [P.], seq 8606:9762, ack 709, win 130, options [nop,nop,TS val 17959646 ecr 3319495043], length 1156
E....}@.4.qm#...	......."..=.'R......\.....
..
...y...\.:..{.'[G.*.F........?@...s;..M...k.ji"..D.drIa...]y.f.n...fa....@.....Ca..7wg..-w..#.......S/A.
.8...f.&...u4.][.~.l..=...+R......b....1................s.{/...d-...Xj.....@....7...Z?.....H.>R..Ay.iU9a2...)..
3.....!.9..$.....'..X.t@hS.	.`.;...4x.qZ......l.......olV......:.6...$)........N=z8.p..o$.-.=..c.?om.....Q.^L.DFrX....~$.......C....Q./..OA......w....+S.^}.....1..0...XB.......yT.
.e.kD=.q]&w..........4.. 	...r.F...."..0.......0..1	.*1......,.:G..7|.|oQ...kt^.{1.
..Oy{{n.N.....w0v&..Yd9........U-.,z{...=F.	...v.` }..X.>wSk.....(.T..Q..K@..T.S...4....alt..ZM.m..B`9.?.Gv]........1v.....E.............<......@o/.z...[.`.p..., ._9L.....D.3.........:T.;.\....X..P...Jv....Oq.~.$.GQ..}...._...P...8.....6..e..A.z.]m$.......x]k..7$...o.!W...
d1{c./..#....,..7.de....'2!Y$cnp"^..,.....H.t|
A.i.......a......H.D4q(2......&.........2...e.J.0&..e1......e.eH....Ki._..}..&..o.........T...a{&..R....qm.z..A.*.V.9E....=Khq..Z.-...........2....-../..K/M.:..f.n[wPS..J ..Q.$iF.g..O......L..."..[...!..:.....P.f.H.....E..$.~,.....z........]...aRJ.@..Gj]......I....5?1[X..p.!Zz....7..'".i.\nA..I....WN.....b....._BJ.a%2.|..^.............	.).~fX.a...%.0....../
14:47:42.964280 IP fcb112782daa.47082 > 25.443: Flags [.], ack 9762, win 452, options [nop,nop,TS val 3319495043 ecr 17959646], length 0
E..4..@.@.c.	...#........'R."........|.....
..y...
.
14:47:43.129465 IP fcb112782daa.8081 > 44.128.0.3.53464: Flags [P.], seq 1:108, ack 269, win 502, options [nop,nop,TS val 3398397757 ecr 3144530015], length 107
E....l@.@.,.	...,.......y..E.l.F....7......
..o=.m._HTTP/1.1 200 OK
Date: Sat, 13 Nov 2021 14:47:43 GMT
Content-type: application/json
Content-length: 2


14:47:43.129769 IP 44.128.0.3.53464 > fcb112782daa.8081: Flags [.], ack 108, win 507, options [nop,nop,TS val 3144530456 ecr 3398397757], length 0
E..4=.@.>...,...	........l.Fy.......7+.....
.m....o=
14:47:43.129826 IP fcb112782daa.8081 > 44.128.0.3.53464: Flags [P.], seq 108:110, ack 269, win 502, options [nop,nop,TS val 3398397758 ecr 3144530456], length 2
E..6.m@.@.-P	...,.......y....l.F....7-.....
..o>.m..{}
14:47:43.130001 IP 44.128.0.3.53464 > fcb112782daa.8081: Flags [.], ack 110, win 507, options [nop,nop,TS val 3144530457 ecr 3398397758], length 0
E..4=.@.>...,...	........l.Fy.......7+.....
.m....o>
14:47:43.130362 IP 44.128.0.3.53464 > fcb112782daa.8081: Flags [F.], seq 269, ack 110, win 507, options [nop,nop,TS val 3144530457 ecr 3398397758], length 0
E..4=.@.>...,...	........l.Fy.......7+.....
.m....o>
14:47:43.130525 IP fcb112782daa.8081 > 44.128.0.3.53464: Flags [F.], seq 110, ack 270, win 502, options [nop,nop,TS val 3398397758 ecr 3144530457], length 0
E..4.n@.@.-Q	...,.......y....l.G....7+.....
..o>.m..
14:47:43.130703 IP 44.128.0.3.53464 > fcb112782daa.8081: Flags [.], ack 111, win 507, options [nop,nop,TS val 3144530457 ecr 3398397758], length 0
E..4=.@.>...,...	........l.Gy.......7+.....
.m....o>
14:47:43.359694 IP fcb112782daa.37288 > 25.443: Flags [FP.], seq 0:31, ack 1, win 502, options [nop,nop,TS val 3319495439 ecr 17854497], length 31
E..S.K@.@.5.	...#.......*.1C... ...........
..{...p!.............>....Vp.n.q2:y...?
14:47:44.227710 IP fcb112782daa.37288 > 25.443: Flags [FP.], seq 0:31, ack 1, win 502, options [nop,nop,TS val 3319496307 ecr 17854497], length 31
E..S.L@.@.5.	...#.......*.1C... ...........
..~s..p!.............>....Vp.n.q2:y...?
14:47:44.645717 IP 44.128.0.3.53504 > fcb112782daa.8081: Flags [S], seq 2657507848, win 64860, options [mss 1380,sackOK,TS val 3144531972 ecr 0,nop,wscale 7], length 0
E..<'.@.>...,...	........fZ........\73.....d...
.m..........
14:47:44.645749 IP fcb112782daa.8081 > 44.128.0.3.53504: Flags [S.], seq 2853364775, ack 2657507849, win 64296, options [mss 1380,sackOK,TS val 3398399274 ecr 3144531972,nop,wscale 7], length 0
E..<..@.@...	...,..........'.fZ	...(73.....d...
..u*.m......
14:47:44.645869 IP 44.128.0.3.53504 > fcb112782daa.8081: Flags [.], ack 1, win 507, options [nop,nop,TS val 3144531973 ecr 3398399274], length 0
E..4'.@.>.. ,...	........fZ	...(....7+.....
.m....u*
14:47:44.646530 IP 44.128.0.3.53504 > fcb112782daa.8081: Flags [P.], seq 1:235, ack 1, win 507, options [nop,nop,TS val 3144531973 ecr 3398399274], length 234
E...'.@.>..5,...	........fZ	...(....8......
.m....u*GET /api/tracks/search?title=Nara&artist=alt-J HTTP/1.1
Accept: */*
User-Agent: Restler for node.js
Host: searchservice.marathon.l4lb.thisdcos.directory:8081
Accept-Encoding: gzip, deflate
Content-Length: 0
Connection: close


14:47:44.646556 IP fcb112782daa.8081 > 44.128.0.3.53504: Flags [.], ack 235, win 502, options [nop,nop,TS val 3398399274 ecr 3144531973], length 0
E..4G?@.@...	...,..........(.fZ.....7+.....
..u*.m..
14:47:44.656140 IP fcb112782daa.8081 > 44.128.0.3.53504: Flags [P.], seq 1:108, ack 235, win 502, options [nop,nop,TS val 3398399284 ecr 3144531973], length 107
E...G@@.@...	...,..........(.fZ.....7......
..u4.m..HTTP/1.1 200 OK
Date: Sat, 13 Nov 2021 14:47:44 GMT
Content-type: application/json
Content-length: 2


14:47:44.656320 IP 44.128.0.3.53504 > fcb112782daa.8081: Flags [.], ack 108, win 507, options [nop,nop,TS val 3144531983 ecr 3398399284], length 0
E..4'.@.>...,...	........fZ.........7+.....
.m....u4
14:47:44.656348 IP fcb112782daa.8081 > 44.128.0.3.53504: Flags [P.], seq 108:110, ack 235, win 502, options [nop,nop,TS val 3398399284 ecr 3144531983], length 2
E..6GA@.@..|	...,............fZ.....7-.....
..u4.m..{}
14:47:44.656439 IP 44.128.0.3.53504 > fcb112782daa.8081: Flags [.], ack 110, win 507, options [nop,nop,TS val 3144531983 ecr 3398399284], length 0
E..4'.@.>...,...	........fZ.........7+.....
.m....u4
14:47:44.656640 IP fcb112782daa.8081 > 44.128.0.3.53504: Flags [F.], seq 110, ack 235, win 502, options [nop,nop,TS val 3398399284 ecr 3144531983], length 0
E..4GB@.@..}	...,............fZ.....7+.....
..u4.m..
14:47:44.656792 IP 44.128.0.3.53504 > fcb112782daa.8081: Flags [F.], seq 235, ack 111, win 507, options [nop,nop,TS val 3144531984 ecr 3398399284], length 0
E..4'.@.>...,...	........fZ.........7+.....
.m....u4
14:47:44.656804 IP fcb112782daa.8081 > 44.128.0.3.53504: Flags [.], ack 236, win 502, options [nop,nop,TS val 3398399285 ecr 3144531984], length 0
E..4GC@.@..|	...,............fZ.....7+.....
..u5.m..
14:47:45.923704 IP fcb112782daa.37288 > 25.443: Flags [FP.], seq 0:31, ack 1, win 502, options [nop,nop,TS val 3319498003 ecr 17854497], length 31
E..S.M@.@.5.	...#.......*.1C... ...........
......p!.............>....Vp.n.q2:y...?
14:47:49.439699 IP fcb112782daa.37288 > 25.443: Flags [FP.], seq 0:31, ack 1, win 502, options [nop,nop,TS val 3319501519 ecr 17854497], length 31
E..S.N@.@.5.	...#.......*.1C... ...........
......p!.............>....Vp.n.q2:y...?
14:47:55.857485 IP 44.128.0.3.42338 > fcb112782daa.8081: Flags [S], seq 541150877, win 64860, options [mss 1380,sackOK,TS val 1882657388 ecr 0,nop,wscale 7], length 0
E..<tk@.>..L,...	....b.. AN........\73.....d...
p7.l........
14:47:55.857515 IP fcb112782daa.8081 > 44.128.0.3.42338: Flags [S.], seq 2634013953, ack 541150878, win 64296, options [mss 1380,sackOK,TS val 3398410485 ecr 1882657388,nop,wscale 7], length 0
E..<..@.@...	...,......b.... AN....(73.....d...
....p7.l....
14:47:55.857626 IP 44.128.0.3.42338 > fcb112782daa.8081: Flags [.], ack 1, win 507, options [nop,nop,TS val 1882657388 ecr 3398410485], length 0
E..4tl@.>..S,...	....b.. AN.........7+.....
p7.l....
14:47:55.858179 IP 44.128.0.3.42338 > fcb112782daa.8081: Flags [P.], seq 1:235, ack 1, win 507, options [nop,nop,TS val 1882657389 ecr 3398410485], length 234
E...tm@.>..h,...	....b.. AN.........8......
p7.m....GET /api/tracks/search?title=Nara&artist=alt-J HTTP/1.1
Accept: */*
User-Agent: Restler for node.js
Host: searchservice.marathon.l4lb.thisdcos.directory:8081
Accept-Encoding: gzip, deflate
Content-Length: 0
Connection: close


14:47:55.858203 IP fcb112782daa.8081 > 44.128.0.3.42338: Flags [.], ack 235, win 502, options [nop,nop,TS val 3398410486 ecr 1882657389], length 0
E..4Y.@.@..;	...,......b.... AO.....7+.....
....p7.m
14:47:55.930934 IP fcb112782daa.8081 > 44.128.0.3.42338: Flags [P.], seq 1:108, ack 235, win 502, options [nop,nop,TS val 3398410559 ecr 1882657389], length 107
E...Y.@.@...	...,......b.... AO.....7......
...?p7.mHTTP/1.1 200 OK
Date: Sat, 13 Nov 2021 14:47:55 GMT
Content-type: application/json
Content-length: 2


14:47:55.931140 IP 44.128.0.3.42338 > fcb112782daa.8081: Flags [.], ack 108, win 507, options [nop,nop,TS val 1882657462 ecr 3398410559], length 0
E..4tn@.>..Q,...	....b.. AO....m....7+.....
p7.....?
14:47:55.931172 IP fcb112782daa.8081 > 44.128.0.3.42338: Flags [P.], seq 108:110, ack 235, win 502, options [nop,nop,TS val 3398410559 ecr 1882657462], length 2
E..6Y.@.@..7	...,......b...m AO.....7-.....
...?p7..{}
14:47:55.931295 IP 44.128.0.3.42338 > fcb112782daa.8081: Flags [.], ack 110, win 507, options [nop,nop,TS val 1882657462 ecr 3398410559], length 0
E..4to@.>..P,...	....b.. AO....o....7+.....
p7.....?
14:47:55.931858 IP fcb112782daa.8081 > 44.128.0.3.42338: Flags [F.], seq 110, ack 235, win 502, options [nop,nop,TS val 3398410560 ecr 1882657462], length 0
E..4Y.@.@..8	...,......b...o AO.....7+.....
...@p7..
14:47:55.931858 IP 44.128.0.3.42338 > fcb112782daa.8081: Flags [F.], seq 235, ack 110, win 507, options [nop,nop,TS val 1882657463 ecr 3398410559], length 0
E..4tp@.>..O,...	....b.. AO....o....7+.....
p7.....?
14:47:55.932030 IP 44.128.0.3.42338 > fcb112782daa.8081: Flags [.], ack 111, win 507, options [nop,nop,TS val 1882657463 ecr 3398410560], length 0
E..4tq@.>..N,...	....b.. AO....p....7+.....
p7.....@
14:47:55.932056 IP fcb112782daa.8081 > 44.128.0.3.42338: Flags [.], ack 236, win 502, options [nop,nop,TS val 3398410560 ecr 1882657463], length 0
E..4Y.@.@..7	...,......b...p AO.....7+.....
...@p7..
